33516,Contract Systems Analyst (Bid Ref 54071-1),1,1,Others,Contract,25 Mar 2025,21 May 2025 to 20 May 2026 (12 months),under InfoTech,Government T26 Contract,"North Wing, 4/F, FSHQ Building, 1 Hong Chong Road, Tsim Sha Tsui East, Kowloon",N/A - N/A,"""(T26) To facilitate the project implementation for the Fourth Generation Mobilising System (4GMS) of the Fire Services Department (FSD).""","""- Serve a contract assignment under InfoTech's headcount, full-time second to serve the FSD; ;Subject to the implementation progress of 4GMS, the CSA will facilitate the following duties related to the 4GMS implementation for the Fire Services Department (FSD):;;(i) to assist the Technical Managers (TM) in the implementation, in particular the Information Management System, of the 4GMS;;(ii) to assist the TM in reviewing, testing and validating the dashboards and reports generating from the 4GMS to present data in a clear and meaningful way;;(iii) to ensure the data integrity, security, and reliability of the data assets through maintenance and optimization;;(iv) to collaborate with other stake holders to understand their data-related requirements and translate them into actionable analytics; ;(v) to carry out other tasks related to data conversion, migration and analysis; ;(vi) to carry out necessary tasks related to the existing mobilising system to ensure a smooth transition to the 4GMS; and;(vii) To undertake any other duties as assigned. ;""",4.0,1.0,"""(i) Bachelor&;#8217;s degree awarded by a post-secondary institution in Hong Kong, including but not limited to the eight University Grants Committee funded universities in Hong Kong, or a bachelor&;#8217;s degree awarded by an overseas university or a polytechnic in the UK, the USA, Canada, New Zealand or Australia; or an accredited associate degree or a higher diploma in information technology from a Hong Kong or overseas tertiary education institute.;(ii) At least 4 years post-qualification information technology experience of which at least 1 years must be in similar post and in comparable capacity.;(iii) At least 3 years working experience in system analysis or data analysis is preferable.;(iv) Advanced experience in data processing applications, e.g. Microsoft Excel, Microsoft SSRS, Oracle SQL, etc. is preferable.;(v) At least 1 year working experience in mission critical system is preferable.;(vi) Good written English & Chinese and fluent spoken English & Chinese. ;Technical Skills: ;. At least 3 years' experience in Office Automation (OAN); ;. At least 2 years' experience in Oracle RDBMS (ODB); ;. At least 2 years' experience in Structured Query Language (SQL); ;. At least 2 years' experience in Microsoft SQL Server (MSS); ;. 3 years' experience in Data Administration (DAM) is an advantage; ;. 2 years' experience in Data Management (DMT) is an advantage; ;. 2 years' experience in MySQL (MSQ) is an advantage; ;. 2 years' experience in SQL Server Reporting Services (SRS) is an advantage; ;. 2 years' experience in XML (XML) is an advantage. ;Non-technical Skills: ;. 2 years' experience in work with the Government (GOV) is an advantage; ;. 2 years' experience in the management and support of Government systems and services (GSS) is an advantage; ;. 2 years' experience in IT Service Management (SMG) is an advantage; ;. 2 years' experience in software testing (STM) is an advantage; ;. 2 years' experience in vendor management (VMG) is an advantage. ;- Bachelor's degree/Higher Diploma in Computer Science, IT or equivalent; ;- At least 4 years' post-qualification experience in which at least 1 year's relevant experience in a similar post and in a comparable capacity.""",N/A,21 Mar 2025,itcareer@infotech.com.hk,2836 0363,"=Hyperlink(""https://www.infotech.com.hk/itjs/job/fe-view.do?method=feView&jjKey=33516"")",,,,DMT,,GOV,,,,,,,,,,,,,,,VMG,,,,,,,,,,,,,,,,,,,,,,,,,,,,,,,,,,,,,,,,,,,,,,,,,,,,,,,,DAM,,,,,,,,,,,,,,,,,,,,,,,,,,,,,,,,,,,,,,,,,,,,,,,,,,GSS,,,,,,,,,,,,,,,,,,,,,,,,,,,,,,,,,,,,,,,,,,,,,,,,,,,,,,,,,,,,,,,,,,,,,,,,,,MSQ,MSS,,,,,,,,,,,,,,,,OAN,,,,ODB,,,,,,,,,,,,,,,,,,,,,,,,,,,,,,,,,,,RDBMS,,,,,,,,,,,,,,,,,,,,,,,SMG,,,,,,SQL,,,SRS,,,,SSRS,,STM,,,,,,,,,,,,,,,,,,,,USA,,,,,,,,,,,,,,,,,,,,,,,,,,,XML,,,,
33068,Contract Project Manager (Bid Ref 53646-3),3,1,Others,Contract,03 Apr 2025,14 Apr 2025 to 30 Sep 2025 (5 months),under InfoTech,Government T26 Contract,Kowloon Bay,N/A - N/A,"""(T26) Manage IT projects, and facilitate the collaboration among stakeholders, including users and technical teams in Social Welfare Department (SWD), Government Bureaux/Departments and relevant organisations, and outsourced contractors, during the implementation/maintenance stages of information systems.""","""- Serve a contract assignment under InfoTech's headcount, full-time second to serve the SWD; ;- Collaborate with SWD services branches and users to identify technology needs and provide tailored solutions.;- Implement IT policies, procedures, and best practices to ensure efficient and safe implementation / operations of IT systems.;- Manage technical staff to develop new IT systems for SWD, oversee the maintenance of existing applications, database systems in SWD.;- Manage project team efforts for IT initiatives, including defining scope, timelines, and resource allocation.;- Supervise in-house development team and outsourced contractors for implementing IT projects and on-going system maintenance.;- Provide technical advice to management and users regarding better use of IT technologies, design of systems, streamline of business process, and project management processes. ;- Perform any other IT related tasks assigned by the supervisor. ;""",14.0,5.0,"""- Solid experience in application system development and project management.;- Strong understanding of IT security principles and best practices in system development and maintenance stage.;- Experience in IT system operation and technical support.;- Experience in vendor management, contract management and IT outsourcing.;- Effective communication skills, both verbal and written, for engaging with technical and non-technical stakeholders.;- Experience in web application development, database management, and website management.;- Knowledge in Microsoft and open source development platforms. ;Technical Skills: ;. At least 4 years' experience in Enterprise Application Integration (EAI); ;. At least 4 years' experience in IT Planning (ITP); ;. At least 4 years' experience in IT Security (ITS); ;. At least 4 years' experience in IT Application Development and Management (ADM); ;. 4 years' experience in Data Management (DMT) is an advantage; ;. 4 years' experience in J2EE Development (JDE) is an advantage. ;Non-technical Skills: ;. At least 4 years' experience in work with the Government (GOV); ;. At least 4 years' experience in managing Government projects (MGP); ;. At least 4 years' experience in IT service/outsourcing management (OUT); ;. At least 4 years' experience in project management (PRM). ;- Bachelor's degree/Higher Diploma in Computer Science, IT or equivalent; ;- At least 14 years' post-qualification experience in which at least 5 years' relevant experience in a similar post and in a comparable capacity.""",N/A,25 Mar 2025,itcareer@infotech.com.hk,2836 0363,"=Hyperlink(""https://www.infotech.com.hk/itjs/job/fe-view.do?method=feView&jjKey=33068"")",ADM,,,DMT,,GOV,,ITP,ITS,,,,,,OUT,,PRM,,,,,,,,,,,,,,,,,,,,,,,,,,,,,,,,,,,,,,,,,,,,,,,,,,,,,,,,,,,,,,,,,,,,,,,,,,,,,EAI,,,,,,,,,,,,,,,,,,,,,,,,,,,,,,,,,,,,,,,,,,,,,,,,,,,,,,,,,,,,,,,,,,,,,,,,,,,,,,,,,,JDE,,,,,,,,,,,,,,,,,,,MGP,,,,,,,,,,,,,,,,,,,,,,,,,,,,,,,,,,,,,,,,,,,,,,,,,,,,,,,,,,,,,,,,,,,,,,,,,,,,,,,,,,,,,,,,,,,,,,,,,,,,,,,,,,,,,,,,,,,,,,,,,,,,,,,,,,,,,,,,,,,,,,,,,,,,,,,
33666,Contract Systems Analyst (Bid Ref 54116-1),1,1,Others,Contract,08 Apr 2025,22 Apr 2025 to 21 Apr 2026 (12 months),under InfoTech,Government T26 Contract,Wanchai or Wong Chuk Hang,N/A - N/A,"""(T26) (I) Maintenance and enhancement of the existing electronic system for selected RGC funding schemes, including adding, modifying, or enhancing system functions, troubleshooting system issues, and providing user support for daily system operations. ;(II) Supporting in the development of a flexible application processing and workflow management system for digitalising the administration of all the existing and future research funding schemes of Research Grants Council (RGC).""","""- Serve a contract assignment under InfoTech's headcount, full-time second to serve the UGC; ;(I) For the existing systems, the duties include the following: ;1. Perform routine maintenance on the existing electronic system to ensure optimal performance and reliability; ;2. Identify and troubleshoot system issues, implementing solutions to resolve problems promptly and minimize downtime; ;3. Add, modify, and enhance system functions based on user feedback and evolving requirements to improve overall system functionality; ;4. Provide user support for daily operations, assisting staff with system-related inquiries and resolving operational challenges; ;5. Work closely with subject teams in the Department and business users to ensure technical compatibility and user satisfaction; ; ;(II) To assist with the new system project, including system analysis and design (SA&D), programming, implementation, data migration, testing, system monitoring, and maintenance. Detail of the duties include: ;1. Carry out quality control and quality assurance, to scrutinize project reports and specifications; ;2. Assist in gathering user requirements and conducting related analysis; ;3. Assist in data migration from legacy systems to the new platform, ensuring data integrity and accuracy; ;4. Conduct thorough data checks to verify that migrated data is complete and correctly formatted; ;5. To assist in the system/UAT testing; ;""",6.0,3.0,"""Requirement Details: ;1. Have a bachelor degree in Computer Sciences or related disciplines ;2. Have good written skills in Chinese and English and fluent in these spoken languages ;3. Proficient in SQL, with the ability to write complex queries and optimize database performance ;4. Strong skills in Java and JSP for developing and enhancing web applications ;5. Experience with WildFly application server for deploying and managing Java applications ;6. Proficiency in both MySQL and MSSQL database management systems, including installation, configuration, and maintenance ;7. Familiarity with Linux operating systems, including command-line usage and basic system administration tasks ;8. Experience in data migration and data synchronization between systems is highly preferable, ensuring data consistency and integrity ;9. Strong problem-solving skills and attention to detail, with a commitment to delivering high-quality results in a fast-paced environment ;10. Ability to work collaboratively in a team environment, effectively communicating technical concepts to non-technical user ;11. Have project development experience in funding scheme system is an advantage ;12. Quick to respond to user requests, demonstrating a solid understanding of their needs and providing timely solutions ;13. Preference will be given to those who have working experience in the HKSAR Government projects ;Technical Skills: ;. At least 5 years' experience in JAVA Programming (JAV); ;. At least 5 years' experience in Java Servlet Programming (JSP); ;. At least 5 years' experience in JavaScript Programming (JAP); ;. At least 5 years' experience in Structured Query Language (SQL); ;. At least 3 years' experience in MySQL (MSQ); ;. 5 years' experience in IT Application Development and Management (ADM) is an advantage; ;. 5 years' experience in HTML version before HTML5 (HTM) is an advantage; ;. 5 years' experience in Java Application Framework (e.g. Struts (Apache)) (JAF) is an advantage; ;. 5 years' experience in System Implementation and Maintenance/Support (SIM) is an advantage; ;. 1 year's experience in Windows Server 2008/2012 (W12) is an advantage; ;. 1 year's experience in JBoss Application Server (JAS) is an advantage; ;. 1 year's experience in Apache Web Server (AWS) is an advantage; ;. 1 year's experience in Data Management (DMT) is an advantage; ;. 1 year's experience in Microsoft SQL Server (MSS) is an advantage; ;. 1 year's experience in SQL*PLUS/PL/SQL/PRO*C (OPL) is an advantage. ;Non-technical Skill: ;. 1 year's experience in work with the Government (GOV) is an advantage. ;- Bachelor's degree/Higher Diploma in Computer Science, IT or equivalent; ;- At least 6 years' post-qualification experience in which at least 3 years' relevant experience in a similar post and in a comparable capacity.""",N/A,25 Mar 2025,itcareer@infotech.com.hk,2836 0363,"=Hyperlink(""https://www.infotech.com.hk/itjs/job/fe-view.do?method=feView&jjKey=33666"")",ADM,,,DMT,,GOV,,,,JAF,JAV,JAVA,,,,,,PRO,,,,,,,,,,,,,,,,,,,AWS,,,,,,,,,,,,,,,,,,,,,,,,,,,,,,,,,,,,,,,,,,,,,,,,,,,,,,,,,,,,,,,,,,,,,,,,,,,,,,,,,,,,,,,,,,,,,,,,,,,,,,HKSAR,,,HTM,HTML,,,,,,,,,,,,,,,,,,,,,,,,,,,,,,JAP,JAS,,,,,,JSP,,,,,,,,,,,,,,,,,,,,,MSQ,MSS,MSSQL,,,,,,,,,,,,,,,,,,,,,,,,OPL,,,,,,,,,,,,,,,,,,PLUS,,,,,,,,,,,,,,,,,,,,,,,,,,,,,,,,,,SIM,,,,,,,SQL,,,,,,,,,,,,,,,,,,,,,,,,,,,,,,,,,,,,,,,,,,,,,,,,,,,,,,,,,,,,
33664,Contract Project Manager (Bid Ref 53657-1),1,1,Others,Contract,08 Apr 2025,01 May 2025 to 30 Apr 2026 (12 months),under InfoTech,Government T26 Contract,Wanchai,N/A - N/A,"""(T26) Assist the Head of BIM Support Team (BST) in providing IT services including planning, procurement, project management, quality assurance and provision of deliverables and advisory service during the planning, initiation and implementation of new IT systems and ongoing support of existing IT systems in BST.""","""- Serve a contract assignment under InfoTech's headcount, full-time second to serve the DSD; ;(a) to undertake internal project management for outsourced services and oversee internal projects, including the development of the Supervisory Control and Data Acquisition (SCADA) Replicator;;(b) to evaluate contractors&;#8217; performance in delivering BIM applications, engineering IT systems / services;;(c) to prepare / review funding application, compile / review tender documentation, and supervise tender evaluations for BIM applications and engineering IT systems / services;;(d) to offer advices and perform business process engineering to enhance the efficiency of BIM-related processes and the departmental BIM Common Data Collaboration Platform (CDCP) within DSD, utilising BIM applications and engineering IT solutions;;(e) to provide technical advices to business users and other IT teams regarding BIM, GIS, Hydrometric Information System(HIS), SCADA and CDCP functionalities;;(f) to liaise and work with business users, IT teams, contractors and stakeholders, including other bureau / departments for completing duties effectively;;(g) to coach and supervise Senior System Analysts, System Analysts and Analyst programmers in BST to ensure the completion of duties and the quality of their deliverables and outcome. ;""",12.0,5.0,"""(a) Holder of a Bachelor degree in Information Technology, Computer Science or related disciplines;;(b) at least twelve (12) years&;#8217; post-qualification Information Technology experience with at least five (5) years in supervisory positions leading IT staff in sizable organisations with emphasis on IT project tender preparation and evaluation, project and contractor management, quality assurance, user requirement study, system analysis and design, system implementation, user training and system support;;(c) proficient in writing IT project / system deliverables in English and able to understand and speak Cantonese and English;;(d) proficient in managing IT development projects and managing / overseeing day-to-day operations of web-based systems. ;(e) at least four (4) years&;#8217; experience on IT service procurement, contract monitoring, user management, quality assurance and IT security audit, and management of multiple IT projects,;(f) experiences on Building Information Modelling (BIM) and Geographic Information Systems (GIS) is essential. ;Technical Skills: ;. At least 5 years' experience in IT Application Development and Management (ADM); ;. At least 5 years' experience in System Implementation and Maintenance/Support (SIM); ;. At least 3 years' experience in Microsoft SQL Server (MSS); ;. At least 3 years' experience in Information System Study (ISS); ;. At least 2 years' experience in IT Planning (ITP); ;. At least 2 years' experience in Security Risk Assessment and Audit (SAA); ;. At least 2 years' experience in Geographic Information System (GIS); ;. At least 1 year's experience in Web Services (WSV); ;. 1 year's experience in Web Programming (WEB) is an advantage; ;. 1 year's experience in Data Architecture (DAR) is an advantage. ;Non-technical Skills: ;. At least 5 years' experience in work with the Government (GOV); ;. At least 5 years' experience in the management and support of Government systems and services (GSS); ;. At least 5 years' experience in managing Government projects (MGP); ;. At least 5 years' experience in IT service/outsourcing management (OUT); ;. At least 5 years' experience in vendor management (VMG); ;. At least 3 years' experience in contract administration (CON); ;. At least 3 years' experience in project management (PRM); ;. At least 3 years' experience in tender preparation and administration (TPA); ;. At least 3 years' experience in Government tendering procedures (GTP); ;. At least 2 years' experience in Government procurement/disposal procedures (GPD). ;- Bachelor's degree/Higher Diploma in Computer Science, IT or equivalent; ;- At least 12 years' post-qualification experience in which at least 5 years' relevant experience in a similar post and in a comparable capacity.""",N/A,25 Mar 2025,itcareer@infotech.com.hk,2836 0363,"=Hyperlink(""https://www.infotech.com.hk/itjs/job/fe-view.do?method=feView&jjKey=33664"")",ADM,CON,,,,GOV,,ITP,,,,,,,OUT,,PRM,,SAA,TPA,VMG,,,,,,,,,,,,,,,,,,,,,BIM,,,,,,,,,,,,,,,,,,,,,,,,,,,,,,,,,,,,DAR,,,,,,,,,,,,,,,,,,,,,,,,,,,,,,,,,,,,,,,,,,,GIS,,,,GPD,,GSS,GTP,,,,,,,,,,,,,,,,,,,,,,,,,,,,,,,,,,,,,,ISS,,,,,,,,,,,,,,,,,,,,,,,,,,,,,MGP,,,,,,,MSS,,,,,,,,,,,,,,,,,,,,,,,,,,,,,,,,,,,,,,,,,,,,,,,,,,,,,,,,,,,,,,,,,,,,,,,,,,,,,SIM,,,,,,,SQL,,,,,,,,,,,,,,,,,,,,,,,,,,,,,,,,,,,,,,,,,,,,,,,WEB,,,,,,,,WSV,,,,,
33657,Contract Senior Systems Analyst (Bid Ref 54092-1),1,1,Application Development,Contract,07 Apr 2025,01 May 2025 to 30 Nov 2025 (7 months),under InfoTech,Government T26 Contract,"Ho Man Tin, Kowloon",N/A - N/A,"""(T26) Implementation project of Asset Management System (AMS)""","""- Serve a contract assignment under InfoTech's headcount, full-time second to serve the HD; ;- To participate and contribute in project stages including but not limited to user requirement collection,;system design & analysis, development, testing, data conversion, user training, nursing, maintenance and;support services for AMS; and;- To assist in tender preparation and vendor management. ;""",6.0,3.0,"""Possess hands-on experience in the following areas:;- Business analysis in information system projects;;- Business requirement and process modeling;;- Proficiency in written English;;- Experience in working in government bureau/department is an advantage;;- Experience in tender preparation is an advantage;;- Experience in asset management is an advantage;;- Experience in implementing or supporting IT applications related to estate property maintenance and;improvement works is an advantage;;- Capable to work independently, under pressure and tight schedule; and;- Meetings at outstation offices located in public rental estates may be required. ;Technical Skills: ;. At least 3 years' experience in System Implementation and Maintenance/Support (SIM); ;. At least 1 year's experience in PRINCE (PRE); ;. 1 year's experience in Enterprise Resource Planning System (ERP) is an advantage; ;. 1 year's experience in Information System Study (ISS) is an advantage. ;Non-technical Skills: ;. At least 2 years' experience in Business Process Modeling (BPM); ;. Excellent written English is a must; ;. 1 year's experience in vendor management (VMG) is an advantage; ;. 1 year's experience in the management and support of Government systems and services (GSS) is an advantage. ;- Bachelor's degree/Higher Diploma in Computer Science, IT or equivalent; ;- At least 6 years' post-qualification experience in which at least 3 years' relevant experience in a similar post and in a comparable capacity.""",N/A,24 Mar 2025,itcareer@infotech.com.hk,2836 0363,"=Hyperlink(""https://www.infotech.com.hk/itjs/job/fe-view.do?method=feView&jjKey=33657"")",,,,,,,,,,,,,,,,PRE,,,,,VMG,,,,,,,,,,,,,,,,,,,,,,,,,BPM,,,,,,,,,,,,,,,,,,,,,,,,,,,,,,,,,,,,,,,,,,,,,,,,,,,,,,,,,,,,,ERP,,,,,,,,,,,,,,,,,,,,GSS,,,,,,,,,,,,,,,,,,,,,,,,,,,,,,,,,,,,,,,ISS,,,,,,,,,,,,,,,,,,,,,,,,,,,,,,,,,,,,,,,,,,,,,,,,,,,,,,,,,,,,,,,,,,,,,,,,,,,,,,,,,,,,,,,,,,,,,,,,,,,,,,,,,,,,,,,,,SIM,,,,,,,,,,,,,,,,,,,,,,,,,,,,,,,,,,,,,,,,,,,,,,,,,,,,,,,,,,,,,,,,,,,
33653,Contract Senior Systems Analyst (Bid Ref 54009-1),1,1,Others,Contract,31 Mar 2025,01 May 2025 to 30 Apr 2026 (12 months),under InfoTech,Government T26 Contract,"Mainly at North Point Government Offices and require to visit sub-offices on HK Island, Kln & NT",N/A - N/A,"""(T26) Monitoring, support and maintenance of departmental network and infrastructure and related services.""","""- Serve a contract assignment under InfoTech's headcount, full-time second to serve the LandsD; ;- monitor and maintain departmental network and resolve infrastructure problems including monitoring and control of network usage, setting up and reconfiguration of routers and switches, IP address assignment;- support and monitor DHCP, DNS and Active Directory servers;- maintain Group Policy on Windows 2019 or above domain;- migration of multiple domains in Active Directory;- provide security advice on applications and infrastructure;- implement the software and security patch deployment system;- provide advice and take part in setting up of new offices and migration of Ethernet broadband services;- set up multi-tier antivirus solutions in email gateway, internet gateway and a large-scaled desktop PCs and servers;- implement the software asset management solution and manipulate the collected data to generate the tailor-made report;- monitor and support the internet traffic by implementing the proxy solution with the web-content filtering;- monitor and support the data encryption servers;- monitor and support the Storage Area Network and Network Attached Storage device;- liaise with E&M and structured Engineers to upgrade the fire extinguishing system, air-conditioning and electricity supply and security access of server rooms. This involves analysis of usage patterns, scheduling and development of operational procedures.;- produce deliverables including technical advice, user requirement specifications, assignment briefs for procurement of hardware, software and services;- take part in all phases of computer projects;- work with different vendors and the teams on computer projects;- support in-house applications when required;- perform any other duties assigned by supervisor ;""",10.0,6.0,"""- In addition to the below technical requirements, 84 months of working experience in Microsoft Active Directory Administration (2012 or above) and 84 months of working experience in server room setup/renovation are must (i.e. mandatory requirements);- Must have solid work experience in liaising with E&M, EMSD, ArchSD and structured Engineers to upgrade the fire extinguishing system, air-conditioning and electricity supply and security access of server rooms. (i.e. mandatory requirements). ;Technical Skills: ;. At least 7 years' experience in Microsoft Active Directory Administration (ADA); ;. At least 7 years' experience in Metro-Ethernet Network (MNE); ;. At least 7 years' experience in Proxy Server (PRS). ;Non-technical Skills: ;. At least 7 years' experience in work with the Government (GOV); ;. At least 7 years' experience in Government procurement/disposal procedures (GPD). ;- Bachelor's degree/Higher Diploma in Computer Science, IT or equivalent; ;- At least 10 years' post-qualification experience in which at least 6 years' relevant experience in a similar post and in a comparable capacity.""",N/A,24 Mar 2025,itcareer@infotech.com.hk,2836 0363,"=Hyperlink(""https://www.infotech.com.hk/itjs/job/fe-view.do?method=feView&jjKey=33653"")",,,,,,GOV,,,,,,,,,,,,,,,,,ADA,,,,,,,,,,,,,,,,,,,,,,,,,,,,,,,,,,,,,,,,,,,,,,,,,,,,,,,,,,,,,,,,,,,,,,,,,,,,,,,,,,EMSD,,,,,,,,,,,,,,,,,,,,GPD,,,,,,,,,,,,,,,,,,,,,,,,,,,,,,,,,,,,,,,,,,,,,,,,,,,,,,,,,,,,,,,,,,,,,,,,MNE,,,,,,,,,,,,,,,,,,,,,,,,,,,,,,,,,,,,,,,,,,,,,,,,,,,PRS,,,,,,,,,,,,,,,,,,,,,,,,,,,,,,,,,,,,,,,,,,,,,,,,,,,,,,,,,,,,,,,,,,,,,,,,,,,,,,,,,,,,,,,,,,,,,,,,,,
