Job Key No,Job Title/ Category,Number Of Vacancy,Relevant Field,Nature,Deadline,Contract Period,Payroll,Employer Business,Location Base,Monthly Salary Range HK$,Project Nature,Duties,Yrs of Total Post-Quali Exp,Yrs of Relevant Exp,Requirements,Work Outside Current Location,Last Update,Apply To,Direct Line,URL
33179,Contract Project Manager (Bid Ref 53520-1),1,Others,Contract,19 Mar 2025,01 May 2025 to 30 Apr 2026 (12 months),under InfoTech,Government T26 Contract,Yau Ma Tei,N/A - N/A,"""(T26) Transport Department has developed a Traffic and Incident Management System (TIM System) to enhance efficiency and effectiveness in managing traffic and transport incidents, and in disseminating traffic and transport information to the public. TIM System has several functions including automatic incident detection, consolidation of traffic and transport contingency plans, provision of traffic information to stakeholders, dissemination of traffic and transport information to the public, and coordination of existing and future traffic control and surveillance systems.""","""- Serve a contract assignment under InfoTech's headcount, full-time second to serve the TD; ;1. To be responsible for system support, maintenance and enhancement of the TIM System;;2. To oversee development of enhancement work of the TIM System;;3. To assist in managing the TIM System maintenance contract along with preparing and managing other contract(s) related to the TIM System;;4. To liaise with parties within TD, OGCIO, government departments and bureaux, users, stakeholders, consultant(s) and contractor(s) on IT related matters in maintenance and enhancement of the TIM System;;5. To manage contractor(s) and service provider(s);;6. To lead, supervise and oversee a team of IT technical contract staff in carrying out tasks for the TIM System;;7. To validate and comment on technical deliverables submitted by the contractor(s) and service provider(s);;8. To formulate and implement IT security policies to safeguard security and integrity of sensitive data stored in the TIM System;;9. To monitor implementation and observance of relevant IT standards and OGCIO guidelines;;10. To provide professional IT support for development of advanced IT technology to enhance efficiency and effectiveness in traffic and incident management;;11. To coordinate returns and inputs on the TIM System and IT related matters as assigned; and;12. To carry out any other tasks on IT related matters as assigned. ;""",8.0,2.0,"""1. The CPM shall possess at least 8 years of post-qualification IT experience including at least 2 years of experience in development and deployment of major government IT project during which at least 1 year shall include IT project(s) where contract value per IT project (excluding maintenance services) is not less than HK$25 million;;2. The CPM shall possess experience in development and deployment of at least one mission critical system;;3. Experience in management of offshore software development will be an advantage;;4. Strong programming skills/ knowledge in Java and Oracle environment;;5. Good communication skills; ;6. Good in English writing skills; and;7. Working outside normal working hours and on irregular hours may be required. ;Technical Skills: ;. At least 4 years' experience in Project Management Professional (PMP) (PMP); ;. At least 2 years' experience in IT Application Development and Management (ADM); ;. At least 2 years' experience in Geographic Information System (GIS); ;. At least 2 years' experience in J2EE Development (JDE); ;. At least 2 years' experience in Oracle RDBMS (ODB); ;. At least 1 year's experience in Information Security Management (ISM); ;. 1 year's experience in JAVA Programming (JAV) is an advantage; ;. 1 year's experience in Object-oriented Analysis and Design (OOA) is an advantage; ;. 1 year's experience in Metro-Ethernet Network (MNE) is an advantage; ;. 1 year's experience in Mobile / Wireless Communication (MWC) is an advantage; ;. 1 year's experience in Security Risk Assessment and Audit (SAA) is an advantage; ;. 1 year's experience in System Implementation and Maintenance/Support (SIM) is an advantage; ;. 1 year's experience in XML (XML) is an advantage. ;Non-technical Skills: ;. At least 3 years' experience in IT service/outsourcing management (OUT); ;. At least 2 years' experience in contract administration (CON); ;. At least 2 years' experience in work with the Government (GOV); ;. At least 2 years' experience in Government procurement/disposal procedures (GPD); ;. At least 1 year's experience in the management and support of Government systems and services (GSS); ;. 1 year's experience in Government tendering procedures (GTP) is an advantage; ;. 1 year's experience in tender preparation and administration (TPA) is an advantage. ;- Bachelor's degree/Higher Diploma in Computer Science, IT or equivalent; ;- At least 8 years' post-qualification experience in which at least 2 years' relevant experience in a similar post and in a comparable capacity.""",N/A,05 Mar 2025,itcareer@infotech.com.hk,2836 0363,"=Hyperlink(""https://www.infotech.com.hk/itjs/job/fe-view.do?method=feView&jjKey=33179"")"
33091,Contract Systems Analyst (Bid Ref 53640-1),1,Application Development,Contract,14 Mar 2025,01 Apr 2025 to 30 Sep 2025 (5 months),under InfoTech,Government T26 Contract,Cheung Sha Wan Government Offices,N/A - N/A,"""(T26) To assist in migration of ESS/E-Link to Government Cloud Infrastructure Services (GCIS). To provide application support, troubleshooting and supervision in managing outsourced system development works of SFO E-Link (https://e-link.wfsfaa.gov.hk/) and SFO E-Link My Applications (https://ess.wfsfaa.gov.hk/), which are public online applications to provide services including application submission, billing information, loan information, partial/lump sum repayment requests, etc. To provide supervision to perform hardware and software upgrade and maintenance by coordinating with data centre, hardware and software suppliers.""","""- Serve a contract assignment under InfoTech's headcount, full-time second to serve the WFSFAA-SFO; ;To supervise application testing and prepare on requirement specification in the business area of financial assistance and grant/loan processing and to provide on-going maintenance of backend application software with Java and XML, with major duties including but not limited to the following:;- to supervise in coordination with the outsourcing contractors for replacement of hardware and software for SFO E-Link and ESS systems;- to supervise in coordination with the outsourcing contractors for data centre to ensure on time delivery of qualified deliverables;- to perform planning and implementation of hardware and 3rd party software upgrade for E-Link and E-Link My Application;- to coordinate with outsourcing contractor and the SOA-DCS2 contractor for the data centre service under SOA-DCS2;- to perform procurement of hardware, software and professional service;- to provide application support/troubleshoot;- to supervise in coordination works with OGCIO staff, contractors and users for on-going maintenance and enhancements;- to overview system status monitoring such as system health check, batch job running status, backup operations;- to assess the technical impact on any infrastructure change and provide advice on enhancing system security status;- to analyze and advise the solution for data exchange between E-Link, E-Link My Applications, backend applications and external institutions;- to administrate security management application for E-Link and E-Link My Application;- to perform database administration including but not limited to Oracle, Microsoft SQL Server, and MySQL;- to support application related to online payment ;""",5.0,3.0,"""- to be good at infrastructure and networking design;- to be good at user communication;- to be familiar with Government IT security policy & guidelines;- to possess in-depth skills and experience in Oracle, Microsoft SQL Server, and MySQL;- to possess hands-on experience in programming (e.g. Apache, HTML, XML, Java, Javascript programming, Visual Studio, iText and JSP) would be an advantage ;Technical Skills: ;. At least 5 years' experience in EGIS (EGI); ;. At least 5 years' experience in JBoss Application Server (JAS); ;. At least 5 years' experience in Oracle RDBMS (ODB); ;. At least 5 years' experience in System Implementation and Maintenance/Support (SIM); ;. At least 3 years' experience in Infrastructure (INF); ;. 1 year's experience in IT Security (ITS) is an advantage; ;. 1 year's experience in Linux System Administration (LIN) is an advantage; ;. 1 year's experience in Microsoft Active Directory Administration (ADA) is an advantage; ;. 1 year's experience in Apache Web Server (AWS) is an advantage; ;. 1 year's experience in Disaster Recovery Planning (DRP) is an advantage; ;. 1 year's experience in Electronic Form (EFM) is an advantage; ;. 1 year's experience in Web Services (WSV) is an advantage; ;. 1 year's experience in Reporting (Crystal Report, iReport) (REP) is an advantage. ;Non-technical Skills: ;. At least 4 years' experience in vendor management (VMG); ;. At least 3 years' experience in contract administration (CON); ;. At least 3 years' experience in work with the Government (GOV); ;. At least 3 years' experience in the management and support of Government systems and services (GSS); ;. At least 3 years' experience in IT service/outsourcing management (OUT); ;. 1 year's experience in IT procurement (PRO) is an advantage. ;- Bachelor's degree/Higher Diploma in Computer Science, IT or equivalent; ;- At least 5 years' post-qualification experience in which at least 3 years' relevant experience in a similar post and in a comparable capacity.""",N/A,28 Feb 2025,itcareer@infotech.com.hk,2836 0363,"=Hyperlink(""https://www.infotech.com.hk/itjs/job/fe-view.do?method=feView&jjKey=33091"")"
33184,Contract Systems Analyst (Bid Ref 53731-1),1,Others,Contract,19 Mar 2025,01 May 2025 to 30 Apr 2026 (12 months),under InfoTech,Government T26 Contract,Outstation office of DEVB in Yau Ma Tei. Work in other offices in Kowloon and Hong Kong occasionally,N/A - N/A,"""(T26) Participate in managing projects, support Government Office Automation (GOA) systems and on-going maintenance of servers.""","""- Serve a contract assignment under InfoTech's headcount, full-time second to serve the DEVB; ;1. To monitor various virtualisation servers, handle incidents and problems, conduct security patches update, prepare system documentations and provide support to users of the IT services.;2. To provide technical advice and support for the New Open Source Departmental Portal (New_OSDP) and the Appeal Tribunal (Buildings) Database System.;3. To coordinate and support for the upgrade of New_OSDP to New_OSDP II.;4. To provide on-going support for enhancing the IT infrastructure based on the latest technology and requirements.;5. To provide administrative support for procurement and maintenance renewal of IT inventory items.;6. To carry out quality control, quality assurance and project management duties as designated by the project manager.;7. To assist in supervising a helpdesk team to provide IT support to end users.;8. To work at different offices to provide IT support occasionally.;9. To work overtime after office hours, on weekends / public holidays during system maintenance periods when required. ;""",9.0,6.0,"""1. Technical knowledge and solid working experience in the management of servers, SAN storages, and tape libraries.;2. Technical knowledge and solid working experience in Microsoft Hyper-V and VMware virtualisation environment.;3. Technical knowledge and solid working experience in Windows Server 2016, 2019 and 2022.;4. Technical knowledge and solid working experience in administration on New_OSDP or New_OSDP II.;5. Knowledge and experience in Government procurement procedures.;6. (Preferred) Hands-on experience on Windows / Linux scripting.;7. (Preferred) Experience in application software such as Arcserve Unified Data Protection and Veeam.;8. (Preferred) Experience in monitoring the performance of outsourcing contractors. ;Technical Skills: ;. At least 6 years' experience in Infrastructure (INF); ;. At least 6 years' experience in Storage Area Network (SAN); ;. At least 6 years' experience in Server Virtualisation Technology (SVT); ;. At least 4 years' experience in Departmental Portal (DPS); ;. 3 years' experience in Data/File Backup Technology (DFT) is an advantage; ;. 3 years' experience in System Implementation and Maintenance/Support (SIM) is an advantage; ;. 3 years' experience in IT Security (ITS) is an advantage; ;. 3 years' experience in Linux System Administration (LIN) is an advantage; ;. 3 years' experience in Network & System Management (NSM) is an advantage; ;. 3 years' experience in Security Risk Assessment and Audit (SAA) is an advantage. ;Non-technical Skills: ;. At least 6 years' experience in work with the Government (GOV); ;. At least 5 years' experience in IT procurement (PRO); ;. At least 5 years' experience in vendor management (VMG); ;. 2 years' experience in Government procurement/disposal procedures (GPD) is an advantage; ;. 2 years' experience in managing Government projects (MGP) is an advantage. ;- Bachelor's degree/Higher Diploma in Computer Science, IT or equivalent; ;- At least 9 years' post-qualification experience in which at least 6 years' relevant experience in a similar post and in a comparable capacity.""",N/A,05 Mar 2025,itcareer@infotech.com.hk,2836 0363,"=Hyperlink(""https://www.infotech.com.hk/itjs/job/fe-view.do?method=feView&jjKey=33184"")"
31084,Contract Systems Analyst (Bid Ref 52367-2),1,Application Development,Contract,17 Mar 2025,01 May 2025 to 30 Apr 2026 (12 months),under InfoTech,Government T26 Contract,Kowloon Bay,N/A - N/A,"""(T26) Please refer to the details provided in """"Job Description""""""","""- Serve a contract assignment under InfoTech's headcount, full-time second to serve the E&MSD; ;1. Update, Administrate and Maintain the Divisional Intranet, Database, IT systems and Servers at EMSD Headquarters and Various Vehicle Pounds/Depots;;2. Take part in all phases and activities of the revamp exercise of Fleet Management Systems (FMS) including collection of signal from CAN-BUS, wireless transmission of signals from individual vehicles to protected server in trust zone, compliance check of ITSS policies, tendering, liaison with service providers, systems analysis, programming and implementation;;3. Design and supervise the integration of onboard vehicle equipment such as real-time camera systems, cellular networking, SOS alert systems and SOS emergency systems.;4. Develop specifications for hardware and network configurations to ensure seamless connectivity, data transfer, and system resilience. Coordinate with engineering/IT teams to test, validate, and optimize solutions for various vehicle platforms and conditions.;5. Oversee system cybersecurity measures and ensure system adherence to update government IT security standards and regulations. ;6. Perform other tasks assigned by the supervisor. ;""",5.0,3.0,"""i.) Degree or Higher diploma in computer subjects or related disciplines; ;ii.) At least five (5) years' post-qualification experience in information technology, of which three (3) years must involve vehicle systems or a comparable capacity;;iii.) Three (3) years or above in IT application development, at least two (2) years on web application development (Website Administration, Web Programming, and Web Services);;iv.) Two (2) years of project management experience in a supervisory role, with demonstrated success in vehicle systems integration or data analysis; ;v.) Five (5) years or above experience in ASP, React, containerization and high-availability data pipelines. Experience with IoT architecture for large fleets, edge computing solutions, and real-time streaming analytics.;vi.) Three (3) years or above experience in SQL/NoSQL databases (e.g., PostgreSQL, SQL Server , MongoDB). Proficiency in latest version in Microsoft Internet Information Services, MS ASP.NET, Visual Studio .NET, Windows Server. Experience with analyzing time series data (e.g., signal readings, performance metrics ,diagnostic trouble codes) to identify trends, anomalies, and optimization opportunities for predictive maintenance.;vii.) Strong commitment to project deadline and delivering high quality work. Ability to work independently, with self-initiative, responsibility, and excellent organization. ;Technical Skills: ;. At least 5 years' experience in LDAP Application Programming (LDA); ;. At least 5 years' experience in Security Risk Assessment and Audit (SAA); ;. At least 5 years' experience in Structured Query Language (SQL); ;. At least 5 years' experience in Wireless/mobile Email solution (WME); ;. At least 3 years' experience in MS ASP.NET (MSA); ;. 5 years' experience in .NET C# (NEC) is an advantage; ;. 5 years' experience in Networking (NET) is an advantage; ;. 5 years' experience in Proxy Server (PRS) is an advantage; ;. 5 years' experience in Red Hat Advanced Server (RHS) is an advantage; ;. 5 years' experience in Router Configuration (ROU) is an advantage; ;. 5 years' experience in Web Services (WSV) is an advantage; ;. 5 years' experience in Security Risk Assessment (SRA) is an advantage; ;. 5 years' experience in SQL Server Reporting Services (SRS) is an advantage; ;. 5 years' experience in TCP/IP (TCP) is an advantage; ;. 5 years' experience in VBA (VBA) is an advantage; ;. 5 years' experience in HTML5 (HT5) is an advantage; ;. 5 years' experience in Web Programming (WEB) is an advantage; ;. 4 years' experience in Experience in C# programming (C#P) is an advantage; ;. 3 years' experience in JavaScript Programming (JAP) is an advantage; ;. 3 years' experience in Internet/ Intranet (INT) is an advantage; ;. 3 years' experience in Website Administration (WEA) is an advantage; ;. 3 years' experience in Microsoft SQL Server (MSS) is an advantage; ;. 3 years' experience in Microsoft Internet Information Services (MIS) is an advantage; ;. 2 years' experience in Mobile / Wireless Communication (MWC) is an advantage; ;. 2 years' experience in Windows Server 2008/2012 (W12) is an advantage; ;. 2 years' experience in Information Security Management (ISM) is an advantage; ;. 2 years' experience in Information System Study (ISS) is an advantage; ;. 2 years' experience in IT Security (ITS) is an advantage; ;. 2 years' experience in IT Application Development and Management (ADM) is an advantage; ;. 2 years' experience in HTML version before HTML5 (HTM) is an advantage; ;. 2 years' experience in Client/Server Application Development (C/S) is an advantage; ;. 2 years' experience in Data Management (DMT) is an advantage; ;. 2 years' experience in Chinese Processing (CHI) is an advantage; ;. 2 years' experience in CISCO IOS Software & CISCO Products (CIP) is an advantage; ;. 2 years' experience in Data Administration (DAM) is an advantage; ;. 1 year's experience in Experience in Datacentre Maintenance (DCM) is an advantage; ;. 1 year's experience in Document Flow/Workflow Management System (DOC) is an advantage; ;. 1 year's experience in Chinese Computing Standards, eg.HKSCS,Big5,Unicode (CCS) is an advantage; ;. 1 year's experience in Windows 7/8/10 (W10) is an advantage. ;Non-technical Skills: ;. At least 3 years' experience in work with the Government (GOV); ;. At least 3 years' experience in Government tendering procedures (GTP); ;. At least 2 years' experience in managing corporate IT security framework (CSF); ;. At least 2 years' experience in managing Government projects (IEG); ;. At least 2 years' experience in tender preparation and administration (TPA); ;. 3 years' experience in IT procurement (PRO) is an advantage; ;. 3 years' experience in IT audit (ITA) is an advantage; ;. 3 years' experience in managing Government IT standards (ITG) is an advantage; ;. 3 years' experience in Government procurement/disposal procedures (GPD) is an advantage; ;. 3 years' experience in the management and support of Government systems and services (GSS) is an advantage; ;. 2 years' experience in contract administration (CON) is an advantage; ;. Good coordination skills is an advantage; ;. 2 years' experience in conducting IT training/briefing (ITT) is an advantage; ;. 2 years' experience in managing Government projects (MGP) is an advantage; ;. Good written English is an advantage; ;. 2 years' experience in project management (PRM) is an advantage; ;. 1 year's experience in presentation (PRT) is an advantage; ;. 1 year's experience in vendor management (VMG) is an advantage; ;. 1 year's experience in presentation (PEX) is an advantage; ;. 1 year's experience in people management (PMG) is an advantage; ;. Good spoken English is an advantage; ;. 1 year's experience in customer relations (ECR) is an advantage; ;. 1 year's experience in helpdesk call handling (HDT) is an advantage. ;- Bachelor's degree/Higher Diploma in Computer Science, IT or equivalent; ;- At least 5 years' post-qualification experience in which at least 3 years' relevant experience in a similar post and in a comparable capacity.""",N/A,03 Mar 2025,itcareer@infotech.com.hk,2836 0363,"=Hyperlink(""https://www.infotech.com.hk/itjs/job/fe-view.do?method=feView&jjKey=31084"")"
33185,Contract Systems Analyst (Bid Ref 53732-1),1,Others,Contract,19 Mar 2025,01 May 2025 to 30 Apr 2026 (12 months),under InfoTech,Government T26 Contract,Outstation office of DEVB in Wan Chai. Work in other offices in Kowloon and Hong Kong occasionally.,N/A - N/A,"""(T26) Manage and support the Government Office Automation (GOA) systems and network infrastructure.""","""- Serve a contract assignment under InfoTech's headcount, full-time second to serve the DEVB; ;1. To study the existing network architecture, research for suitable advanced technologies and re-design the network architecture for higher flexibility and future expansion.;2. To plan, oversee and monitor for the provision of IT support services and administration of IT matters.;3. To provide technical advice and support on IT infrastructure and enhancing the IT security in the office.;4. To review daily security alerts and perform any upgrading and patching to the equipment deployed in the office.;5. To conduct regular health check of network equipment and rectify issues found.;6. To perform planning for implementation of new IT projects and prepare the requirements specifications for procurement of IT systems, network products and services.;7. To supervise the work and monitor the performance of a Contract Senior IT Assistant for the provision of IT support and troubleshooting services to end users.;8. To work at different offices to provide IT support occasionally.;9. To work overtime after office hours, on weekends / public holidays during system maintenance periods when required. ;""",9.0,7.0,"""1. Technical knowledge and solid working experience in administration on departmental network involving servers, network equipment (including proxy and firewall, etc.) and security appliances / devices (e.g. malware / anti-virus / IDS / IPS solution).;2. Well-versed in H3C network routers and switches configuration, covering settings related to BGP, OSPF, ACL and SNMP.;3. Technical knowledge and solid working experience in administration on GOA systems.;4. Hands-on experience and troubleshooting skills in root cause analysis, providing work-around / solution to the problems, fire-fighting scenarios.;5. Knowledge and solid experience in Government procurement procedures, including hardware / software / service through bulk contract and / or direct purchase.;6. (Preferred) Experience in monitoring the performance of outsourcing contractors.;7. (Preferred) Possession of valid certificate of Certified Information Systems Auditor (CISA). ;Technical Skills: ;. At least 7 years' experience in Internet Firewall Technical Support (IFW); ;. At least 7 years' experience in Intrusion Prevention System (IPS); ;. At least 7 years' experience in Network Design (NDN); ;. At least 7 years' experience in Network & System Management (NSM); ;. At least 7 years' experience in Router Configuration (ROU); ;. 3 years' experience in System Implementation and Maintenance/Support (SIM) is an advantage; ;. 3 years' experience in Virtual Private Network (VPN) is an advantage; ;. 3 years' experience in IT Security (ITS) is an advantage; ;. 3 years' experience in Infrastructure (INF) is an advantage; ;. 3 years' experience in Internet/ Intranet (INT) is an advantage; ;. 3 years' experience in Anti-Virus Technology (AVT) is an advantage. ;Non-technical Skills: ;. At least 6 years' experience in work with the Government (GOV); ;. At least 5 years' experience in IT procurement (PRO); ;. At least 5 years' experience in vendor management (VMG); ;. 2 years' experience in Government procurement/disposal procedures (GPD) is an advantage; ;. 2 years' experience in managing Government projects (MGP) is an advantage. ;- Bachelor's degree/Higher Diploma in Computer Science, IT or equivalent; ;- At least 9 years' post-qualification experience in which at least 7 years' relevant experience in a similar post and in a comparable capacity.""",N/A,05 Mar 2025,itcareer@infotech.com.hk,2836 0363,"=Hyperlink(""https://www.infotech.com.hk/itjs/job/fe-view.do?method=feView&jjKey=33185"")"
