33369,Contract Systems Analyst (Bid Ref 53926-1),1,1,Others,Contract,24 Mar 2025,01 May 2025 to 30 Apr 2026 (12 months),under InfoTech,Government T26 Contract,"5/F, Office Building, CADHQs 1 Tung Fai Road, Hong Kong International Airport, Hong Kong",N/A - N/A,"""(T26) 1. Assist PM on overall project assessment of cyber security plans of aviation security stakeholders""","""- Serve a contract assignment under InfoTech's headcount, full-time second to serve the CAD; ;1. Assist to closely monitor the international requirements on cybersecurity; ;2. Assist to review the cybersecurity programmes of all aviation stakeholders; ;3. Assist to ensure the related stakeholders have established an effective cybersecurity response plan; ;4. Assist to conduct audits and regular inspections on the aviation stakeholders for the aspect of cyber-security; and ;5. Assist to ensure the related stakeholders conduct drills / exercises to test the adequacy and effectiveness of the contingency plans in responding to any cyberattacks ;""",4.0,1.0,"""1. Degree Holder in Information Technology / Electronics Engineering or equivalent; ;2. At least 4 years of IT experience; ;3. At least 1 years of experience in similar capacity in the post of System Analyst; ;4. At least 1 years of experience in IT project management in cyber security / information security management; and ;5. Familiar with OGCIO guidelines on Project Management and IT security related to Information Technology. ;Technical Skills: ;. At least 3 years' experience in Information Security Management (ISM); ;. At least 2 years' experience in Document Management System (DMS); ;. 2 years' experience in Disaster Recovery Planning (DRP) is an advantage; ;. 2 years' experience in Intruder Detection/Alert Technology (IDA) is an advantage; ;. 2 years' experience in Security Risk Assessment and Audit (SAA) is an advantage. ;Non-technical Skills: ;. At least 2 years' experience in quality assurance (QAS); ;. At least 2 years' experience in quality management (QMT); ;. 2 years' experience in quality audit under CMMI or ISO (QAT) is an advantage. ;- Bachelor's degree/Higher Diploma in Computer Science, IT or equivalent; ;- At least 4 years' post-qualification experience in which at least 1 year's relevant experience in a similar post and in a comparable capacity.""",N/A,17 Mar 2025,itcareer@infotech.com.hk,2836 0363,"=Hyperlink(""https://www.infotech.com.hk/itjs/job/fe-view.do?method=feView&jjKey=33369"")",,,,,,,ISM,,,,,,,,,,,,SAA,,,,,,,,,,,,,,,,,,,,,,,,,,,,,,,,,,,,,,,,,,,,,,,,,,,,,,,,,,,,,,,,,,,,DMS,,,DRP,,,,,,,,,,,,,,,,,,,,,,,,,,,,,,,,,,,,,,,,,,,,,,,,,,,,,,,,,,,IDA,,,,,,,,,,,,,,,,ISO,,,,,,,,,,,,,,,,,,,,,,,,,,,,,,,,,,,,,,,,,,,,,,,,,,,,,,,,,,,,,,,,,,,,,,,,,,,,,,,,,,,,,,QAS,QMT,,,,,,,,,,,,,,,,,,,,,,,,,,,,,,,,,,,,,,,,,,,,,,,,,,,,,,,,,,,,,,,,,,,,,,,,,,,,,,,,,,,,,,,,,,,,,,QAT
33247,Contract Senior Systems Analyst (Bid Ref 53763-1),1,1,Others,Contract,24 Mar 2025,01 May 2025 to 30 Apr 2026 (12 months),under InfoTech,Government T26 Contract,EMSD Headquarters,N/A - N/A,"""(T26) 1. Planning, implementation and upgrading of an IT project for building up a GIS platform with an electronic map that facilitates the emergency support mechanism during incidents. ;2. Development and Support for the database and relevant interface for user input, review and setting. ;3. Provision of maintenance and enhancement services for the existing database and relevant interface. ;4. Planning and implementation of ad-hoc software projects. ;5. Provision of technical advices and IT support to projects for the upgrading / maintenance / replacement of software and hardware. ;6. Negotiation and cooperation with the corresponding parties (e.g. contractor) for filling the above nature(s).""","""- Serve a contract assignment under InfoTech's headcount, full-time second to serve the E&MSD; ;1. Participate in IT projects throughout its life cycle including feasibility study, user expectation management and change management. ;2. Design, develop, test and commission a software for a GIS platform with an electronic map for monitoring and analysing the operational data of different electrical and mechanical (E&M) engineering systems. ;3. Design, develop, test & commission ,maintenance and enhance databases and relevant interfaces for recording, inputting, consolidating, verifying, analysing and displaying operation data of administration. ;4. Analyse business requirements and have them converted into system design. ;5. Responsible for project execution within budget and time frame, measuring/identify potential risk and recommends risk mitigation wherever appropriate. ;6. Propose system development strategy and plan. Evaluate and recommend new IT products and services. ;7. Monitor the performance and ensure quality support of all existing IT production systems. ;8. Integrate dashboard UX/UI design. ;9. Acquire user requirements, coordinate with consultants, contractors and internal staff for various project matters. ;10. Conduct in-house software design, debugging, testing, commissioning and documentation. ;11. Manage contractors and service outsourcing. ;12. Ensure service deliverables to be completed on time and meet quality standard. ;13. Carry out any other IT services and ad-hoc duties assigned by supervisors. ;""",6.0,2.0,"""1. Holder of at least Bachelor degree in Computer Science, Computer Engineering, Computing Studies, Information Systems, Information Technology or Information Engineering or equivalent. ;2. Solid experience in hand-on programming is required. ;3. Solid experience in working with Tableau and Mapbox is required. ;4. Solid experience in working with MS SQL Server and MongoDB is required. ;5. Master degree in IT related discipline is a plus. ;6. Knowledge on geocoding handling is a plus. ;7. Strong commitment to project deadline and delivering high outcomes. ;8. Creative, analytical, self-initiative, responsible and well-organized. ;9. Good team player and leader, proactive communication with teammates and subordinates. ;Technical Skills: ;. At least 6 years' experience in Geographic Information System (GIS); ;. At least 6 years' experience in JavaScript Programming (JAP); ;. At least 6 years' experience in Microsoft SQL Server (MSS); ;. At least 6 years' experience in System Implementation and Maintenance/Support (SIM); ;. At least 6 years' experience in Web 2.0 Services (W2S); ;. 2 years' experience in Smartcard Technology (SMT) is an advantage; ;. 2 years' experience in IT Application Development and Management (ADM) is an advantage; ;. 2 years' experience in Documentum (DUM) is an advantage; ;. 2 years' experience in Security Risk Assessment and Audit (SAA) is an advantage. ;Non-technical Skills: ;. At least 6 years' experience in work with the Government (GOV); ;. At least 6 years' experience in IT service/outsourcing management (OUT); ;. At least 6 years' experience in vendor management (VMG). ;- Bachelor's degree/Higher Diploma in Computer Science, IT or equivalent; ;- At least 6 years' post-qualification experience in which at least 2 years' relevant experience in a similar post and in a comparable capacity.""",N/A,10 Mar 2025,itcareer@infotech.com.hk,2836 0363,"=Hyperlink(""https://www.infotech.com.hk/itjs/job/fe-view.do?method=feView&jjKey=33247"")",ADM,,,,,GOV,,,,,,,,,OUT,,,,SAA,,VMG,,,,,,,,,,,,,,,,,,,,,,,,,,,,,,,,,,,,,,,,,,,,,,,,,,,,,,,,,,,,,,,,,,,,,,DUM,,,,,,,,,,,,,,,,,,,,,,,,,,,,,,GIS,,,,,,,,,,,,,,,,,,,,,,,,,,,,,,,,,,,,,,,,,,,,,,,,,,,,JAP,,,,,,,,,,,,,,,,,,,,,,,,,,,,,MSS,,,,,,,,,,,,,,,,,,,,,,,,,,,,,,,,,,,,,,,,,,,,,,,,,,,,,,,,,,,,,,,,,,,,,,,,,,,,,SIM,,SMT,,,,,SQL,,,,,,,,,,,,,,,,,,,,,,,,,,,,,,,,,,,,,,,,,,,,,,,,,,,,,,,,,,,,
33246,Contract Systems Analyst (Bid Ref 53758-1),1,1,Others,Contract,24 Mar 2025,01 May 2025 to 04 May 2026 (12 months),under InfoTech,Government T26 Contract,Kowloon Bay,N/A - N/A,"""(T26) For Systems of HKeToll and Regional Digitization Control Centres ;(i) Reviewing and analyzing daily performance of front-end Data Acquisition System of HKeToll for Government Tolled Tunnels from high level transaction records to low level raw data/system logs provided by the system; ;(ii) Reviewing, analyzing, evaluating and recommending improvement advices of Back-end System (BES) and Toll Services Provider (TSP) of Free-Flow Tolling System; ;(iii) Reviewing, analyzing, evaluating and recommending improvement in IBMS and system performance in Regional Digitization Control Centres; ;(iv) Provide weekly performance evaluation report and Issue & Fault Log Review and Recording Contractor management; ;(v) Assisting BTSD in project co-ordinations for Regional Digitization Control Centres and Free Flow Tolling System; ;(vi) Assisting BTSD to take up the future maintenance, operation and performance monitoring of Free-Flow Tolling System.""","""- Serve a contract assignment under InfoTech's headcount, full-time second to serve the E&MSD; ;For HKeToll systems ;A. Review and analyze daily DAS performance data from high level transaction records to low level raw data/system logs provided by contractor. The analysis results shall be in the form of report, charts and figures presentation to facilitate contractor's rectification works; ;B. Review and advise on abnormalities (i.e. event/incident/failure) observed from the data analysis that would affect DAS operations; ;C. Provide weekly performance evaluation report and Issue & Fault Log Review and Recording; ;D. Review the test results against final design proposal of BES and TSP, including all mobile applications, account management on internet and mobile applications, all BES and TSP software applications (on Government Cloud Infrastructure System, GCIS) to identify any shortfalls and recommend improvement measures; ;E. Provide recommendations on how to control the modification, bug fixing, improvement and upgrade of DAS, BES and TSP. ; ;For Regional Digitization Control Centres ;F. Assist in the coordination works with Contractor and the responsible officer ;G. Monitor the work progress of IBMS system integration works and data visualization development works. ;H. Provide comment to the user layout ;I. Join testing and commissioning of system and software ;""",8.0,3.0,"""i) Degree or Higher diploma in computer subjects/statistic/data science/mathematic or related disciplines; ;ii) 8 years or above solid IT application/system development experience; ;iii) Microsoft Certified Power BI Data Analyst Associate certification holder; ;iv) PCPP1 & Certified Professional Python Programmer Level 1 certification holder; ;v) current or former holder of Project Management Professional (PMP) certification; ;vi) 3 years or above experience in working with Database system on MySQL/MariaDB or equivalent; ;vii) Knowledge and solid experience in analyzing large volumes of data and drawing meaningful insights to ensure accurate transaction verification and system performance; ;viii) Knowledge and solid experience in developing / implementing Power BI&;#8212;a business intelligence tool; ;ix) Experience in Python programming for data analysis; ;x) Experience in working with databases, e.g. SQL queries, and data extraction tools to retrieve and manipulate data for analysis and verification purposes; ;xi) Knowledge and solid experience in developing dashboard and user Interface for Operator and Maintenance; ;xii) Provide recommendation and sound solution based on the complex datasets reviews and analysis; ;xv) Knowledge in matching algorithm, deep data learning and machine learning may be an advantage, such as familiarity with deep learning techniques enables the analyst to apply neural networks and advanced models to extract valuable insights from large and complex datasets, leading to improved accuracy in transaction verification and system performance analysis; ;xvi) Knowledge in different matching algorithms be an advantage, such as fuzzy matching or probabilistic matching, helps in accurately matching transaction data and complex datasets with corresponding records and detecting any inconsistencies or errors; ;xvii) Knowledge in the quality controls of software changes, software upgrade, access right, etc. may be an advantage; ;xviii) Knowledge in the system security controls may be an advantage; ;xix) Knowledge in intelligent building management system may be an advantage; ;xx) Knowledge in network design may be an advantage; ;xxi) Experience in web server systems using Java, .NET, Node.js, SQL Server, MongoDB may be an advantage; ;xxii) Strong commitment to project deadline and delivering high quality work; ;xxiii) Creative, analytical, self-initiative, responsible and well-organized. ;Technical Skills: ;. At least 5 years' experience in Data Administration (DAM); ;. At least 5 years' experience in Data Modeling (DMO); ;. At least 4 years' experience in business intelligence/data mining (BDM); ;. At least 4 years' experience in Object-oriented Analysis and Design (OOA); ;. At least 4 years' experience in SSADM (SDM); ;. At least 2 years' experience in Structured Query Language (SQL); ;. At least 2 years' experience in Project Management Professional (PMP) (PMP); ;. At least 2 years' experience in .Net Development (NDE); ;. 2 years' experience in EGIS (EGI) is an advantage; ;. 2 years' experience in JavaScript Programming (JAP) is an advantage; ;. 2 years' experience in Linux System Administration (LIN) is an advantage; ;. 2 years' experience in Unix/Linux Shell Scripting (ULS) is an advantage. ;Non-technical Skills: ;. At least 4 years' experience in software testing (STM); ;. At least 1 year's experience in work with the Government (GOV); ;. 2 years' experience in Government procurement/disposal procedures (GPD) is an advantage; ;. 2 years' experience in the management and support of Government systems and services (GSS) is an advantage; ;. 2 years' experience in IT service/outsourcing management (OUT) is an advantage. ;- Bachelor's degree/Higher Diploma in Computer Science, IT or equivalent; ;- At least 8 years' post-qualification experience in which at least 3 years' relevant experience in a similar post and in a comparable capacity.""",N/A,10 Mar 2025,itcareer@infotech.com.hk,2836 0363,"=Hyperlink(""https://www.infotech.com.hk/itjs/job/fe-view.do?method=feView&jjKey=33246"")",,,,,,GOV,,,,,,,,NET,OUT,,,,,,,,,,,,,,,,,,,,,,,,,BDM,,,,,,,,,,,,,,,,,,,,,,,,,,,,,,,,,,,,,DAM,,,,,,,,,DMO,,,,,,,,,,,,,EGI,,,,,,,,,,,,,,,,,,,,,,,,,,GPD,,GSS,,,,,,,,,,,,,,,,,,,,,,,,,,,,,,,,,,,,,,,,,,,,,,JAP,,,,,,,,,,,,,,LIN,,,,,,,,,,,,,,,,,,,,,,,NDE,,,,,,,,,,,,,,,,OOA,,,,,,,,,,,,,,,,,,,,,PMP,,,,,,,,,,,,,,,,,,,,,,,,,,,,SDM,,,,,,,,,,,SQL,,,,,,,,,STM,,,,,,,,,,,,,,ULS,,,,,,,,,,,,,,,,,,,,,,,,,,,,,,,,,,,,,
33224,Contract Project Manager (Bid Ref 53692-1),1,1,Others,Contract,24 Mar 2025,28 Apr 2025 to 31 Dec 2025 (8 months),under InfoTech,Government T26 Contract,WANCHAI,N/A - N/A,"""(T26) This is a CPM position for managing and providing infrastructure service to the Electronic System for Cargo Manifest (EMAN) system that cover desktops, gateways, networks, servers and IT security.""","""- Serve a contract assignment under InfoTech's headcount, full-time second to serve the DPO; ;- To ensure maximum system availability and meet defined service levels of EMAN; ;- To plan, manage, develop and implement new enhancements of EMAN and on quality assurance; ;- To manage the EMAN infrastructure support team and contractors for provisioning the support services that are in place; ;- To identify the service needs and prepare relevant specifications documents to facilitate the procurement of hardware, software and maintenance services for EMAN system; and ;- To perform the tasks assigned by the line manager. ;""",8.0,2.0,"""- Require good project management and technical consultancy skills; ;- Require solid experience in manage outsourced system support operation of large scale IT systems. It is preferable with exposure in mission critical Government IT system; ;- Require solid experience in the technical skills required; and ;- Criminal record checking is required. ;Technical Skills: ;. At least 2 years' experience in Infrastructure (INF); ;. At least 2 years' experience in Network & System Management (NSM); ;. At least 2 years' experience in Security Incident Detection and Handling (SDH); ;. At least 2 years' experience in Server Virtualisation Technology (SVT); ;. 1 year's experience in Multi-vendor Mission Critical System (MCS) is an advantage. ;Non-technical Skills: ;. At least 1 year's experience in vendor management (VMG); ;. 1 year's experience in the management and support of Government systems and services (GSS) is an advantage; ;. 1 year's experience in managing Government projects (IEG) is an advantage. ;- Bachelor's degree/Higher Diploma in Computer Science, IT or equivalent; ;- At least 8 years' post-qualification experience in which at least 2 years' relevant experience in a similar post and in a comparable capacity.""",N/A,10 Mar 2025,itcareer@infotech.com.hk,2836 0363,"=Hyperlink(""https://www.infotech.com.hk/itjs/job/fe-view.do?method=feView&jjKey=33224"")",,,,,,,,,,,,,,,,,,,,,VMG,,,,,,,,,,,,,,,,,,,,,,,,,,,,,,,,,,,,,,,,,,,,,,,,,,,,,,,,,,,,,,,,,,,,,,,,,,,,,,,,,,,,,,,,,,,,,,,,,,,,,,,,,,GSS,,,,,,,,,,,,,,,,,,,,,,,,,,IEG,,,,,,INF,,,,,,,,,,,,,,,,,,,,,,,,,,,,,,,,,MCS,,,,,,,,,,,,,,,,,,,,,,,NSM,,,,,,,,,,,,,,,,,,,,,,,,,,,,,,,,,,,,,,,,,,,,,,,,,,,,,,,,,,SDH,,,,,,,,,,,,,,,,,,,,,,,,SVT,,,,,,,,,,,,,,,,,,,,,,,,,,,,,,,,,,,,,,,,,,,,,,,,,
33509,Contract Senior Systems Analyst (Bid Ref 54011-1),1,1,Others,Contract,07 Apr 2025,02 Jun 2025 to 27 Feb 2026 (8 months),under InfoTech,Government T26 Contract,Tseung Kwan O and occasionally provide support at Immigration offices including control points,N/A - N/A,"""(T26) Enhancement support of Corporate Data Repository (CDR)""","""- Serve a contract assignment under InfoTech's headcount, full-time second to serve the ImmD; ;To be responsible for various enhancements for CDR and the database migration for system integration with ImmD&;#8217;s application systems, and subsequent 7x24 on-call support on CDR which include:;- work with contractors to perform hardware and software upgrade on the infrastructure components of CDR;;- oversee and ensure the data migration of CDR is executed in a proper and concise order when performing the required hardware and software upgrade;;- coordinate with related stakeholders from both business and technical aspects and provide technical support for system enhancements;;- plan and implement security enhancements on the database of CDR;;- provide operational support on various application components including HACMP, TSM and job scheduler;;- plan and coordinate Disaster Recovery (DR) drill for CDR and ImmD&;#8217;s application systems;;- perform study and proof-of concept for database products for CDR;;- execute and assure the proper change management; and;- perform other duties assigned by supervisor. ;""",6.0,2.0,"""The candidate shall possess the following essential technical skills:;(a) well-versed in DB2 database administration including SQL commands and database tuning;;(b) proficient in IBM AIX UNIX system administration;;(c) solid experience in supporting the system components of the CDR including HACMP, TSM and job scheduler;;(d) experience in security access control on database; and;(e) experience in coordinating and supporting the DR drill activities.;;Criminal record check will be required. ;Technical Skills: ;. At least 3 years' experience in Broadband Network (BNE); ;. At least 3 years' experience in Tivoli Storage Management (TSM); ;. At least 2 years' experience in Tivoli Workload Scheduler (TWS); ;. At least 2 years' experience in Disaster Recovery Planning (DRP). ;Non-technical Skill: ;. At least 2 years' experience in work with the Government (GOV). ;- Bachelor's degree/Higher Diploma in Computer Science, IT or equivalent; ;- At least 6 years' post-qualification experience in which at least 2 years' relevant experience in a similar post and in a comparable capacity.""",N/A,21 Mar 2025,itcareer@infotech.com.hk,2836 0363,"=Hyperlink(""https://www.infotech.com.hk/itjs/job/fe-view.do?method=feView&jjKey=33509"")",,,,,,GOV,,,,,,,,,,,,,,,,,,,AIX,,,,,,,,,,,,,,,,,,,,,,,,,,,,,,,CDR,,,,,,,,,,,,,,,,,,,,,,,,,,,,,,,,,,DRP,,,,,,,,,,,,,,,,,,,,,,,,,,,,,,,,,,,,,,,,,,,,,,,,,,,,,,,,IBM,,,,,,,,,,,,,,,,,,,,,,,,,,,,,,,,,,,,,,,,,,,,,,,,,,,,,,,,,,,,,,,,,,,,,,,,,,,,,,,,,,,,,,,,,,,,,,,,,,,,,,,,,,,,,,,,,,,,,,,,,,,,,,,,,,,,,,,,,,,,SQL,,,,,,,,,,,,,,,,,TSM,,TWS,,,,,,,,,,,,,,,,,,,,,,,,,,,,,,,,,,,,,,BNE,,,
33382,Contract Systems Analyst (Bid Ref 53938-1),1,1,Application Development,Contract,24 Mar 2025,01 Apr 2025 to 30 Sep 2025 (5 months),under InfoTech,Government T26 Contract,Ho Man Tin,N/A - N/A,"""(T26) System enhancement implementation for Application and Allocation System (AAS)""","""- Serve a contract assignment under InfoTech's headcount, full-time second to serve the HD; ;- To perform requirements collection, system analysis & design, development, testing, deployment and enhancement for AAS ;;- To provide on-going maintenance supports for AAS ;;- To migrate and develop reporting services to for AAS ;;- To review and / or prepare SDLC documentation; and;- To perform any other tasks as assigned by supervisors. ;""",6.0,1.0,"""Possess the following skills and hands-on experience:;- At least 1 years of experience as Systems Analyst and 6 years of experience in IT;;- Solid experience in JAVA web application development;;- Solid experience in Struct, Spring, JSP, JavaScript, AJAX, JSON, CSS, Orcale SQL, iBatis, MyBatis, PLSQL, IBM Webspere, JBoss, Maven, Jenkins;;- Experience with implementing/operating IT applications on Cloud plaforms;;- Solid experience in Control-M batch job scheduling and administration;- Strong analytical and problem solving skills in business and technical aspects.;- Capable to work under pressure and tight schedule ;Technical Skills: ;. At least 6 years' experience in Java Application Framework (e.g. Struts (Apache)) (JAF); ;. At least 6 years' experience in JavaScript Programming (JAP); ;. At least 6 years' experience in JAVA Programming (JAV); ;. At least 2 years' experience in batch job monitoring (BJM). ;Non-technical Skill: ;. 1 year's experience in work with the Government (GOV) is an advantage. ;- Bachelor's degree/Higher Diploma in Computer Science, IT or equivalent; ;- At least 6 years' post-qualification experience in which at least 1 year's relevant experience in a similar post and in a comparable capacity.""",N/A,17 Mar 2025,itcareer@infotech.com.hk,2836 0363,"=Hyperlink(""https://www.infotech.com.hk/itjs/job/fe-view.do?method=feView&jjKey=33382"")",,,,,,GOV,,,,JAF,JAV,,,,,,,,,,,,,,,,,,,,,,,,,,,,,,,,BJM,,,,,,,,,,,,,,,,,,,,,,,,,,,,,,,,,CSS,,,,,,,,,,,,,,,,,,,,,,,,,,,,,,,,,,,,,,,,,,,,,,,,,,,,,,,,,,,,,,,,,,,,,,IBM,,,,,,,,,,,,,,,,,,,,,,,,,,,JAP,,,,,,,JSP,,,,,,,,,,,,,,,,,,,,,,,,,,,,,,,,,,,,,,,,,,,,,,,,,,,,,,,,,,,,,,,,,,,,,,,,,,,,,,,,,,,,,,,,,,,,,,,,,,,,,,,,,,SQL,,,,,,,,,,,,,,,,,,,,,,,,,,,,,,,,,,,,,,,,,,,,,,,,,,,,,,,,,,,,
33255,Contract Systems Analyst (Bid Ref 53474-1),1,1,Others,Contract,25 Mar 2025,02 May 2025 to 15 Mar 2026 (10 months),under InfoTech,Government T26 Contract,Quarry Bay,N/A - N/A,"""(T26) Upgrade and support for network infrastructure of Central Cyber Government Office (CCGO) and Central Reverse Proxy Services (CRPS)""","""- Serve a contract assignment under InfoTech's headcount, full-time second to serve the DPO; ;- to support the upgrade of CCGO network infrastructure ;- to provide technical support on network infrastructure of CCGO ;- to provide usage support to users of B/Ds in using CRPS ;""",4.0,1.0,"""Practical experience in providing technical and operational support on network infrastructure and related hardware and software, including DNS, router, switches, firewalls and load balancer ;Knowledge in integration of 2nd factor authentication solution with network infrastructure related hardware ;Knowledge in network proxy services using the Source Network Address Translation (SNAT) technology ;Technical Skills: ;. At least 2 years' experience in Infrastructure (INF); ;. At least 1 year's experience in Network Design (NDN); ;. At least 1 year's experience in Router Configuration (ROU); ;. 1 year's experience in Ethernet (ETH) is an advantage. ;Non-technical Skills: ;. Good coordination skills is a must; ;. 1 year's experience in work with the Government (GOV) is an advantage; ;. 1 year's experience in vendor management (VMG) is an advantage. ;- Bachelor's degree/Higher Diploma in Computer Science, IT or equivalent; ;- At least 4 years' post-qualification experience in which at least 1 year's relevant experience in a similar post and in a comparable capacity.""",N/A,11 Mar 2025,itcareer@infotech.com.hk,2836 0363,"=Hyperlink(""https://www.infotech.com.hk/itjs/job/fe-view.do?method=feView&jjKey=33255"")",,,,,,GOV,,,,,,,,,,,,,,,VMG,,,,,,,,,,,,,,,,,,,,,,,,,,,,,,,,,,,,,,,,,,,,,,,,,,,,,,,,,,,,,,,,,,,,,,,,,,,,,,,,,,,,,,,,,,,,ETH,,,,,,,,,,,,,,,,,,,,,,,,,,,,,,,,,,,,,,,,,,,,,,INF,,,,,,,,,,,,,,,,,,,,,,,,,,,,,,,,,,,,,,,,,,,,,,,,,,,,NDN,,,,,,,,,,,,,,,,,,,,,,,,,,,,,,,,,,,,,,,,,,,,,,,,,,,,ROU,,,,,,,,,,,,,,,,,,,,,,,,,,,,,,,,,,,,,,,,,,,,,,,,,,,,,,,,,,,,,,,,,,,,,,,,,,,,,,,,,DNS,,
