33030,Contract Systems Analyst (Bid Ref 53592-1),1,Others,Contract,10 Mar 2025,01 May 2025 to 30 Apr 2026 (12 months),under InfoTech,Government T26 Contract,"Macau Ferry Terminal, Sheung Wan, Hong Kong",N/A - N/A,"""(T26) - Maintenance and support of in-house applications and outsourced IT applications; ;- Maintenance and support of the network infrastructure of Marine Department Local Area Network (MD LAN) for Vessel Traffic Centre (VTC), Hong Kong Maritime Rescue Coordination Centre (MRCC), Engineering and System Section at Macau Ferry Terminal, and Vessel Traffic Services (VTS) System.""","""- Serve a contract assignment under InfoTech's headcount, full-time second to serve the MD; ;- Provide helpdesk, IT administrative and technical support to end users; ;- Perform daily system administration, operations, maintenance and support to various in-house applications and outsourced IT applications; ;- Perform network architecture and security design, network implementation, and on-going network administration; ;- Perform Office Automation (OA) implementation, hardware and software upgrade and maintain system documentations; ;- Manage and implement system and network enhancement projects; ;- Manage frontline staff to administrate, test and deploy patches to servers and client workstations and network equipment in compliance with Government and Departmental IT Security Policy, Standards and Practices; ;- Liaise with different parties including end users, contractors, other departmental units, etc.; ;- Follow up findings of IT security risk assessment & audit; ;- Research and evaluate the latest products, tools, and practices to recommend cost-effective solutions; ;- Assist in procurement of IT hardware and software, and IT service contracts; ;- Maintain and update hardware and software inventory records; ;- Plan and manage the subscription of communications, telephone and fax lines; ;- Perform any other duties assigned by supervisors; and ;- Emergency on-call support after office hours is required. ;""",4.0,1.0,"""- A degree holder in Information Engineering, Computer Science or related disciplines; ;- Possess a valid Cisco Certified Network Associate (CCNA) Certificate or Huawei Certified Network Associate (HCNA) Certificate, or higher; ;- Hands-on experience in LAN or OA related implementation projects and support activities with backend network and servers, and frontend PC, notebook, mobile devices; ;- Solid hands-on experience in Windows and Linux servers, VMware virtualization, LAN networking, network device management and PC management; ;- Experience in IT security solution design, endpoint IT security solutions, IT security risk assessment & audit and familiar with Government IT security policies and guidelines; ;- Relevant post-qualification experience in system design, development and maintenance related to database analysis and modeling, web application development, MS SQL and/or Oracle database administration; ;- Relevant post-qualification experience on design, implementation and management of network or system infrastructure and security with components such as servers, storage, network switch, firewall, data backup tools etc.; ;- Experience in development, implementation and maintenance of applications using php and .NET framework would be an advantage; ;- Procession of certifications of Cisco Certified Network Professional (CCNP) / Huawei Certified Network Professional (HCNP) / Certified Information Systems Security Professional (CISSP) / Information Technology Infrastructure Library (ITIL) is preferable; ;- Self-motivated and good sense of responsibility; ;- Strong self-learning and research ability; ;- Strong commitment to project deadlines and delivering high-quality work; and ;- Good trouble-shooting, interpersonal and communication skills. ;Technical Skills: ;. At least 3 years' experience in System Implementation and Maintenance/Support (SIM); ;. At least 2 years' experience in Microsoft Active Directory Administration (ADA); ;. At least 2 years' experience in IT Security (ITS); ;. At least 2 years' experience in Network & System Management (NSM); ;. At least 2 years' experience in Office Automation (OAN); ;. 2 years' experience in IT Application Development and Management (ADM) is an advantage. ;Non-technical Skills: ;. At least 3 years' experience in customer service (CLS); ;. At least 3 years' experience in IT Service Management (SMG); ;. At least 2 years' experience in managing Government IT standards (ITG); ;. At least 2 years' experience in vendor management (VMG); ;. 2 years' experience in software testing (STM) is an advantage; ;. 2 years' experience in Government procurement/disposal procedures (GPD) is an advantage. ;- Bachelor's degree/Higher Diploma in Computer Science, IT or equivalent; ;- At least 4 years' post-qualification experience in which at least 1 year's relevant experience in a similar post and in a comparable capacity.""",N/A,24 Feb 2025,itcareer@infotech.com.hk,2836 0363,"=Hyperlink(""https://www.infotech.com.hk/itjs/job/fe-view.do?method=feView&jjKey=33030"")"
33189,Contract Project Manager (Bid Ref 53715-1),1,Others,Contract,20 Mar 2025,01 May 2025 to 30 Apr 2026 (12 months),under InfoTech,Government T26 Contract,Wan Chai,N/A - N/A,"""(T26) Management of IT application and system development in EDB""","""- Serve a contract assignment under InfoTech's headcount, full-time second to serve the EDB; ;To lead and manage a team; and;To carry out requirement study, analysis, design, development and implementation for IT systems; and;To provide training, technical support and advice to users of IT systems and in IT activities ;""",8.0,2.0,"""(a) At least 15 years of post-qualification IT experience of which 10 years' experience in managing application and system development;;(b) At least 10 years' experience in Government IT projects; and;(c) At least 5 years' experience in developing/supporting application system using Microsoft Active Directory. ;Technical Skills: ;. At least 10 years' experience in IT Application Development and Management (ADM); ;. At least 5 years' experience in System Implementation and Maintenance/Support (SIM); ;. At least 5 years' experience in Microsoft Active Directory Administration (ADA); ;. 2 years' experience in Structured Query Language (SQL) is an advantage; ;. 2 years' experience in JAVA Programming (JAV) is an advantage; ;. 2 years' experience in Microsoft SQL Server (MSS) is an advantage. ;Non-technical Skills: ;. At least 10 years' experience in work with the Government (GOV); ;. Good written English is a must; ;. At least 5 years' experience in project management (PRM); ;. 2 years' experience in quality management (QMT) is an advantage. ;- Bachelor's degree/Higher Diploma in Computer Science, IT or equivalent; ;- At least 8 years' post-qualification experience in which at least 2 years' relevant experience in a similar post and in a comparable capacity.""",N/A,06 Mar 2025,itcareer@infotech.com.hk,2836 0363,"=Hyperlink(""https://www.infotech.com.hk/itjs/job/fe-view.do?method=feView&jjKey=33189"")"
33020,Contract Senior Systems Analyst (Bid Ref 52997-1),1,Others,Contract,10 Mar 2025,01 May 2025 to 30 Apr 2026 (12 months),under InfoTech,Government T26 Contract,Ho Man Tin Government Offices,N/A - N/A,"""(T26) Manage the maintenance and support for Excavation Permit Management System (XPMS)""","""- Serve a contract assignment under InfoTech's headcount, full-time second to serve the HyD; ;Supervise and organize enhancement for XPMS.;Supervise and organize data centre services.;Monitor the user acceptance tests on the system enhancements.;Monitor the delivery of on-going support and maintenance services.;Conduct ad-hoc tasks such as data analysis and review of system performance etc. ;""",9.0,7.0,"""Please refer to technical requirement.;Besides, the candidate MUST have at least 36 months solid on job experience in ESRI ArcGIS Server and at least 12 months solid job experience in Veeam Backup & Replication. ;Technical Skills: ;. At least 7 years' experience in Geographic Information System (GIS); ;. At least 7 years' experience in J2EE Development (JDE); ;. At least 7 years' experience in Oracle Real Application Cluster (OAC); ;. At least 7 years' experience in WebLogic Server Administration (WLG); ;. At least 4 years' experience in Document Flow/Workflow Management System (DOC); ;. 4 years' experience in JavaScript Programming (JAP) is an advantage; ;. 4 years' experience in JAVA Programming (JAV) is an advantage. ;Non-technical Skill: ;. 4 years' experience in work with the Government (GOV) is an advantage. ;- Bachelor's degree/Higher Diploma in Computer Science, IT or equivalent; ;- At least 9 years' post-qualification experience in which at least 7 years' relevant experience in a similar post and in a comparable capacity.""",N/A,24 Feb 2025,itcareer@infotech.com.hk,2836 0363,"=Hyperlink(""https://www.infotech.com.hk/itjs/job/fe-view.do?method=feView&jjKey=33020"")"
33166,Contract Project Manager (Bid Ref 53652-1),1,Others,Contract,19 Mar 2025,02 May 2025 to 31 Dec 2025 (7 months),under InfoTech,Government T26 Contract,ImmD HQ at Tseung Kwan O and occasionally at various Immigration control points and offices,N/A - N/A,"""(T26) To manage and coordinate the implementation of Immigration CONtrol Systems (ICONS) at the new control points, to oversee the implementation of system interfaces of ICONS and external departments and the planning and implementation of new initiatives for immigration clearance.""","""- Serve a contract assignment under InfoTech's headcount, full-time second to serve the ImmD; ;(a) To plan and manage the implementation of ICONS at new control point at New T2; ;(b) To coordinate with project teams and contractors for the implementation of system interfaces with Housing Department and Hong Kong Tourism Board for ICONS; ;(c) To provide management support and technical advice for the planning and implementation of new initiatives for automated clearance; ;(d) To plan and manage on the implementation of new trend of immigration clearance; ;(e) To conduct quality assurance and manage the performance of contractors; and ;(f) To perform any other duties as may be required for meeting the department's business need. ;""",8.0,2.0,"""- Strong experience in implementation and support for mission critical systems ;- Strong experience in project coordination and management ;- Strong experience in vendor management ;- The contract staff is required to take up on-call duty ;- The contract Staff will normally work in ImmD HQ at Tseung Kwan O, and occasionally provide support at various Immigration control points and offices ;- The contract Staff will have to work outside normal office hours occasionally to meet the operational needs ;- Criminal record check is required ;Technical Skills: ;. At least 5 years' experience in Multi-vendor Mission Critical System (MCS); ;. At least 5 years' experience in Project Management Professional (PMP) (PMP); ;. At least 4 years' experience in batch job monitoring (BJM); ;. At least 4 years' experience in DB2 (DB2). ;Non-technical Skill: ;. At least 4 years' experience in managing Government projects (MGP). ;- Bachelor's degree/Higher Diploma in Computer Science, IT or equivalent; ;- At least 8 years' post-qualification experience in which at least 2 years' relevant experience in a similar post and in a comparable capacity.""",N/A,05 Mar 2025,itcareer@infotech.com.hk,2836 0363,"=Hyperlink(""https://www.infotech.com.hk/itjs/job/fe-view.do?method=feView&jjKey=33166"")"
33212,Contract Systems Analyst (Bid Ref 53710-1),1,Application Development,Contract,21 Mar 2025,01 May 2025 to 31 Jan 2027 (21 months),under InfoTech,Government T26 Contract,Kowloon Bay,N/A - N/A,"""(T26) 1. Lead, participate, monitor and support in digital transformation in EMSD with leading-edge technologies, including Agentic AI Projects, Semantic AI Development Projects, Integrated Building Management Projects, and Energy Saving Projects, and mission critical tasks such as awards / event racings and exhibition works. ;2. Lead and participate in feasibility studies, user requirements gathering, and the design and development, testing and documentation of application systems. This includes interfacing with integrated Building Management System (iBMS) and other information systems to collect, process, and analyze building operational data, aimed at facilitating further optimization of building systems and conducting in-depth data analysis.;3. Lead and participate in the design and development of APIs for integration with a centralized data repository and other information systems. This involves ensuring the efficient storage, processing, and analysis of collected data, supporting""","""- Serve a contract assignment under InfoTech's headcount, full-time second to serve the E&MSD; ;1. Conduct user requirements gathering, system analysis, design applications. Lead and perform coding, testing and deployment of application programs, leveraging cutting-edge AI technologies, particularly Large Language Models (LLMs), machine learning, and emerging AI solutions;;2. Lead and perform test plan, test cases/scripts, testing/ pre-production environment, perform Unit Test, System Integration Test, UAT;;3. Lead and perform system health check, Root Cause Analysis, Problem and Issues Reporting;;4. Lead system implementation of proof-of-concepts, perform technical studies, and execute related projects;;5. Lead and conduct pilot testing and technical evaluations of emerging technologies across multiple platforms and software stacks;;6. Coordinate with contractors to oversee project progress and ensure deliverable quality standards;;7. Develop comprehensive user manuals and technical documentation;;8. Enhance, maintain, and support the AI models for evolving system development needs;;9. Perform any related tasks as assigned by Senior Engineer/Engineer(s).;10. To undertake any other duties as required by supervisor(s). ;""",4.0,2.0,"""1. Degree or Higher diploma in computer subjects or related disciplines;;2. Solid experience in web server systems using Node.js, Python, Java, JavaScript;;3. Experience in web application development, RESTful API design, and development and integration;;4. Proven ability to conduct thorough feasibility studies, user requirements gathering, and system analysis & design;;5. Solid experience in SQL and NoSQL databases management (MongoDB, MS SQL, and MySQL);;6. Basic machine learning concepts, and statistical analysis skills is a plus;;7. Good hands on knowledge in Windows, Linux or other operating system(s) is a definite advantage;;8. Good troubleshooting and debugging skills;;9. Strong analytical and problem-solving skills;;10. Good technical documentation and communication skills;;11. Ability to quickly adapt and learn new technologies and systems;;12. Self-motivated with ability to work in a collaborative environment;;13. Creative, self-initiative, responsible, well-organized, and work independently on complex tasks. ;Technical Skills: ;. At least 4 years' experience in IT Application Development and Management (ADM); ;. At least 4 years' experience in Data Modeling (DMO); ;. At least 4 years' experience in Data Management (DMT); ;. At least 3 years' experience in JavaScript Programming (JAP); ;. At least 3 years' experience in JAVA Programming (JAV); ;. At least 3 years' experience in MySQL (MSQ); ;. At least 2 years' experience in Microsoft SQL Server (MSS); ;. 3 years' experience in HTML version before HTML5 (HTM) is an advantage; ;. 3 years' experience in Apache Web Server (AWS) is an advantage; ;. 3 years' experience in batch job monitoring (BJM) is an advantage; ;. 2 years' experience in PHP programming (PHP) is an advantage. ;Non-technical Skills: ;. At least 3 years' experience in work with the Government (GOV); ;. At least 3 years' experience in IT Service Management (SMG); ;. At least 3 years' experience in software testing (STM); ;. At least 3 years' experience in vendor management (VMG); ;. Good coordination skills is an advantage. ;- Bachelor's degree/Higher Diploma in Computer Science, IT or equivalent; ;- At least 4 years' post-qualification experience in which at least 2 years' relevant experience in a similar post and in a comparable capacity.""",N/A,07 Mar 2025,itcareer@infotech.com.hk,2836 0363,"=Hyperlink(""https://www.infotech.com.hk/itjs/job/fe-view.do?method=feView&jjKey=33212"")"
33140,Contract Systems Analyst (Bid Ref 53689-1),1,Application Development,Contract,17 Mar 2025,02 May 2025 to 30 Apr 2026 (11 months),under InfoTech,Government T26 Contract,Wong Chuk Hang,N/A - N/A,"""(T26) To provide IT support for the development of district-based community health system and other initiatives as recommended in the Primary Healthcare (PHC) Blueprint.""","""- Serve a contract assignment under InfoTech's headcount, full-time second to serve the HHB; ;The successful applicant will report to a Systems Manager or equivalent. He/She will be responsible for the following: ;a) To participate in the preparation of the requirement specification, workflow design, user acceptance test, system operation procedures and rollout of the IT systems for district-based community health system and other initiatives as recommended in the Primary Healthcare (PHC) Blueprint; ;b) To provide support in data extraction and generation of management information; ;c) To provide assistance on technical evaluation; and ;d) Any other tasks assigned by the supervisor or the Health Bureau (HHB). ;""",6.0,2.0,"""a) Solid experience in various aspects of system implementation, including preparation of requirement specifications, workflow design, User Acceptance Test, system operation procedures etc; ;b) Solid hands-on experience in various programming languages, including VBA, HTML5, Java, CSS, JavaScript; ;c) Experience in managing government projects; ;d) Work experience in healthcare industry will be an advantage; ;e) Strong analytical and problem-solving skill; ;f) Strong communication skills both in written and oral English; and ;g) Responsible and self-motivated, and able to work under pressure. ;Technical Skills: ;. At least 5 years' experience in System Implementation and Maintenance/Support (SIM); ;. At least 4 years' experience in Web Programming (WEB); ;. At least 2 years' experience in VBA (VBA); ;. 4 years' experience in IT Application Development and Management (ADM) is an advantage; ;. 1 year's experience in Website Administration (WEA) is an advantage. ;Non-technical Skills: ;. At least 2 years' experience in Clinical Related Information System (CRS); ;. At least 2 years' experience in work with the Government (GOV); ;. 2 years' experience in IT service/outsourcing management (OUT) is an advantage; ;. 1 year's experience in IT procurement (PRO) is an advantage. ;- Bachelor's degree/Higher Diploma in Computer Science, IT or equivalent; ;- At least 6 years' post-qualification experience in which at least 2 years' relevant experience in a similar post and in a comparable capacity.""",N/A,03 Mar 2025,itcareer@infotech.com.hk,2836 0363,"=Hyperlink(""https://www.infotech.com.hk/itjs/job/fe-view.do?method=feView&jjKey=33140"")"
33190,Contract Project Manager (Bid Ref 53716-1),1,Others,Contract,20 Mar 2025,01 May 2025 to 30 Apr 2026 (12 months),under InfoTech,Government T26 Contract,Wan Chai,N/A - N/A,"""(T26) Management of IT application and system development in EDB""","""- Serve a contract assignment under InfoTech's headcount, full-time second to serve the EDB; ;To lead and manage a team; and ;To carry out feasibility study, requirement study, analysis, design, development and implementation for finance system; and;To provide training, technical support and maintenances and advice to users of IT systems and in IT activities ;""",8.0,2.0,"""(a) At least 25 years of post-qualification IT experience of which 20 years' experience in managing application and system development; and ;(b) At least 2 years' experience in Government IT projects ;Technical Skills: ;. At least 20 years' experience in IT Application Development and Management (ADM); ;. At least 20 years' experience in Client/Server Application Development (C/S); ;. At least 20 years' experience in COBOL (COB); ;. At least 20 years' experience in DB2 (DB2); ;. At least 20 years' experience in Production Database Support (PDS); ;. At least 20 years' experience in System Implementation and Maintenance/Support (SIM); ;. At least 20 years' experience in Structured Query Language (SQL); ;. 20 years' experience in JAVA Programming (JAV) is an advantage; ;. 20 years' experience in Microsoft Internet Information Services (MIS) is an advantage; ;. 20 years' experience in Oracle RDBMS (ODB) is an advantage. ;Non-technical Skills: ;. At least 20 years' experience in negotiation (NEG); ;. At least 20 years' experience in people management (PMG); ;. At least 20 years' experience in project management (PRM); ;. At least 10 years' experience in IT procurement (PRO); ;. At least 2 years' experience in work with the Government (GOV); ;. 10 years' experience in vendor management (VMG) is an advantage. ;- Bachelor's degree/Higher Diploma in Computer Science, IT or equivalent; ;- At least 8 years' post-qualification experience in which at least 2 years' relevant experience in a similar post and in a comparable capacity.""",N/A,06 Mar 2025,itcareer@infotech.com.hk,2836 0363,"=Hyperlink(""https://www.infotech.com.hk/itjs/job/fe-view.do?method=feView&jjKey=33190"")"
33111,Contract Systems Analyst (Bid Ref 53567-1),1,Application Development,Contract,17 Mar 2025,01 May 2025 to 30 Apr 2026 (12 months),under InfoTech,Government T26 Contract,"28/F Southorn Centre, Wanchai, Hong Kong",N/A - N/A,"""(T26) Departmental Application Development and Support""","""- Serve a contract assignment under InfoTech's headcount, full-time second to serve the EPD; ;1. Application maintenance and hotline support of Environmental Protection Interactive Centre (EPIC) e-Form licensing applications and daily operations of EPIC payment servers;;2. Application enhancement of EPIC applications for requests by users and Security Risk Assessment and Audit (SRAA);;3. Application enhancement, system maintenance, and daily hotline support of Internal Departmental Portal Applications (IDPA);;4. Jobs as assigned by supervisor. ;""",5.0,3.0,"""1. Degree in Information Technology or Equivalent or Higher;;2. Good command of English and Chinese; ;3. Solid experience in project management;;4. Good communication skills and ability to work with team members and vendors. ;Technical Skills: ;. At least 3 years' experience in JBoss Application Server (JAS); ;. At least 3 years' experience in J2EE Development (JDE); ;. At least 3 years' experience in Public Key Infrastructure (PKI); ;. 1 year's experience in System Implementation and Maintenance/Support (SIM) is an advantage; ;. 1 year's experience in Structured Query Language (SQL) is an advantage; ;. 1 year's experience in Server Virtualisation Technology (SVT) is an advantage; ;. 1 year's experience in JavaServer Faces (JSF) (JSF) is an advantage; ;. 1 year's experience in Oracle RDBMS (ODB) is an advantage; ;. 1 year's experience in Adobe LiveCycle ES (ALC) is an advantage; ;. 1 year's experience in Electronic Form (EFM) is an advantage; ;. 1 year's experience in EGIS (EGI) is an advantage. ;Non-technical Skills: ;. At least 2 years' experience in managing Government projects (MGP); ;. Good written English is a must; ;. At least 2 years' experience in work with the Government (GOV); ;. 1 year's experience in the management and support of Government systems and services (GSS) is an advantage; ;. 1 year's experience in IT service/outsourcing management (OUT) is an advantage; ;. 1 year's experience in IT procurement (PRO) is an advantage; ;. 1 year's experience in vendor management (VMG) is an advantage. ;- Bachelor's degree/Higher Diploma in Computer Science, IT or equivalent; ;- At least 5 years' post-qualification experience in which at least 3 years' relevant experience in a similar post and in a comparable capacity.""",N/A,03 Mar 2025,itcareer@infotech.com.hk,2836 0363,"=Hyperlink(""https://www.infotech.com.hk/itjs/job/fe-view.do?method=feView&jjKey=33111"")"
