33182,Contract Senior Systems Analyst (Bid Ref 53725-1),1,Others,Contract,19 Mar 2025,01 May 2025 to 30 Apr 2026 (12 months),under InfoTech,Government T26 Contract,Outstation office of DEVB in Yau Ma Tei. Work in other offices in Kowloon and Hong Kong occasionally,N/A - N/A,"""(T26) Provide IT project management for implementation of new projects and technical support services to the existing production systems in the Bureau.""","""- Serve a contract assignment under InfoTech's headcount, full-time second to serve the DEVB; ;1. To perform procurement and implementation for the new projects including the upgrade of Storage Area Network (SAN) and the rollout of Central Electronic Recordkeeping System, etc.;2. To manage, optimise, enhance and support the existing computing infrastructure adopting virtualisation technology.;3. To conduct market research, technical analysis and evaluation on the adoption of virtualisation and data encryption technologies.;4. To carry out quality control, quality assurance and project management duties as designated by project manager.;5. To manage and coordinate vendor activities and monitor their performance.;6. To supervise the work and monitor the performance of the subordinates.;7. To work at different offices to provide IT support occasionally.;8. To work overtime after office hours, on weekends / public holidays during system maintenance periods when required. ;""",12.0,8.0,"""1. Technical knowledge and solid working experience in the management of servers, SAN storages, SAN switches and tape libraries.;2. Technical knowledge and solid working experience in Microsoft Hyper-V virtualisation environment with fail-over clustering.;3. Technical knowledge and solid working experience in VMware virtualisation environment (including proficiency in VMware vCenter 7 or above and VMware vSphere 7 or above).;4. Technical knowledge and solid working experience in managing Windows Server 2016, 2019 and 2022.;5. Solid working experience in data encryption technologies (including Windows BitLocker, McAFee Drive Encryption, Windows Encrypting File System, Virtual Private Network and cryptographic key management systems) with knowledge in the encryption mechanisms and protocols.;6. Solid working experience in applying hardware snapshot technology of SAN storage in data protection solution under Microsoft Hyper-V / VMware environment.;7. Experience in Physical-to-Virtual conversion of Windows servers.;8. Experience in conducting feasibility / technical studies on IT system implementation.;9. Experience in supervising and monitoring the performance of a team.;10. Experience in vendor management.;11. (Preferred) Experience in application software such as Microsoft Certification Authority, Arcserve Unified Data Protection and Veeam. ;Technical Skills: ;. At least 8 years' experience in Infrastructure (INF); ;. At least 8 years' experience in Data Encryption Technology (DET); ;. At least 8 years' experience in Storage Area Network (SAN); ;. At least 8 years' experience in Server Virtualisation Technology (SVT); ;. 3 years' experience in Virtual LAN/LAN Switching (VLS) is an advantage; ;. 3 years' experience in Windows 7/8/10 (W10) is an advantage; ;. 3 years' experience in System Implementation and Maintenance/Support (SIM) is an advantage; ;. 3 years' experience in Data/File Backup Technology (DFT) is an advantage; ;. 3 years' experience in IT Planning (ITP) is an advantage; ;. 3 years' experience in IT Security (ITS) is an advantage; ;. 3 years' experience in Security Risk Assessment and Audit (SAA) is an advantage. ;Non-technical Skills: ;. At least 8 years' experience in work with the Government (GOV); ;. At least 8 years' experience in IT procurement (PRO); ;. At least 8 years' experience in vendor management (VMG); ;. 3 years' experience in Government procurement/disposal procedures (GPD) is an advantage; ;. 3 years' experience in managing Government projects (MGP) is an advantage. ;- Bachelor's degree/Higher Diploma in Computer Science, IT or equivalent; ;- At least 12 years' post-qualification experience in which at least 8 years' relevant experience in a similar post and in a comparable capacity.""",N/A,05 Mar 2025,itcareer@infotech.com.hk,2836 0363,"=Hyperlink(""https://www.infotech.com.hk/itjs/job/fe-view.do?method=feView&jjKey=33182"")"
33123,Contract Senior Systems Analyst (Bid Ref 53566-1),1,Application Development,Contract,17 Mar 2025,01 May 2025 to 30 Apr 2026 (12 months),under InfoTech,Government T26 Contract,"Revenue Tower, 5 Gloucester Road, Wan Chai, Hong Kong.",N/A - N/A,"""(T26) Development of smart system for EPD's public electric vehicle chargers""","""- Serve a contract assignment under InfoTech's headcount, full-time second to serve the EPD; ;1. Oversee the back-end system and mobile application, carry out quality control and quality assurance of the development of the IT system for collating and disseminating Electric Vehicles (EV) charging information and an application system / a dashboard for internal monitoring and reporting;;2. Prepare tender documents and specifications for system and programme design, development, user requirements, system requirements, etc., as well as operation and maintenance procedures / manuals. ;3. Liaise and communicate among users, data owners, other Government departments (or their contractors);;4. Monitor the systems design, procurement and installation of computer systems, implementation and maintenance, etc.; ;5. Monitor and report system testing and user acceptance test; and;6. Assign PM to manage the MOM contractors. ;""",6.0,2.0,"""1. Degree or above in Computer Science;2. Proficient in Government web systems and mobile applications.;3. Experience in development, implementation, operation, maintenance of systems in Government.;4. Experience in cloud computing and management.;5. Experience in IT security and SRAA of Government projects.;6. Hands-on experience in EV charging systems operating with OCPP (version 1.6J or above).;7. Hands-on experience in Government public-facing systems.;8. Hands-on experience in Government e-payment system and payment kiosks.;9. Hands-on experience in MOM contract administration. ;Technical Skills: ;. At least 4 years' experience in Data Architecture (DAR); ;. At least 4 years' experience in IT Planning (ITP); ;. At least 4 years' experience in System Implementation and Maintenance/Support (SIM); ;. 4 years' experience in Structured Query Language (SQL) is an advantage; ;. 4 years' experience in Network & System Management (NSM) is an advantage; ;. 4 years' experience in Information Security Management (ISM) is an advantage. ;Non-technical Skills: ;. At least 4 years' experience in Government tendering procedures (GTP); ;. At least 4 years' experience in managing Government IT standards (ITG); ;. At least 4 years' experience in quality assurance (QAS); ;. 4 years' experience in IT service/outsourcing management (OUT) is an advantage; ;. 4 years' experience in managing Government projects (IEG) is an advantage; ;. 4 years' experience in contract administration (CON) is an advantage; ;. 4 years' experience in managing corporate IT security framework (CSF) is an advantage. ;- Bachelor's degree/Higher Diploma in Computer Science, IT or equivalent; ;- At least 6 years' post-qualification experience in which at least 2 years' relevant experience in a similar post and in a comparable capacity.""",N/A,03 Mar 2025,itcareer@infotech.com.hk,2836 0363,"=Hyperlink(""https://www.infotech.com.hk/itjs/job/fe-view.do?method=feView&jjKey=33123"")"
33134,Contract Systems Analyst (Bid Ref 53557-1),1,Application Development,Contract,17 Mar 2025,01 May 2025 to 30 Apr 2026 (12 months),under InfoTech,Government T26 Contract,"8/F, Cheung Sha Wan Government Offices, 303 Cheung Sha Wan Road, Kowloon",N/A - N/A,"""(T26) System Maintenance and Support for the ENDMEM System, Administer the network and system security of the infrastructure of the ENDMEM Mobile Extension Module""","""- Serve a contract assignment under InfoTech's headcount, full-time second to serve the EPD; ;1. To provide system support for the ENDMEM system;2. To assist monitoring of the performance of the maintenance contractor of the ENDMEM system;3. To troubleshoot system problems of the ENDMEM system ;4. To manage the network infrastructure of the ENDMEM Mobile Extension Module ;""",6.0,1.0,"""1. Degree in Information Technology or Higher, and;2. Good knowledge in applications, system development and application maintenance ;Technical Skills: ;. At least 3 years' experience in Geographic Information System (GIS); ;. At least 3 years' experience in WebLogic Server Administration (WLG); ;. At least 1 year's experience in CISCO IOS Software & CISCO Products (CIP); ;. 2 years' experience in FileNet (FLN) is an advantage; ;. 1 year's experience in JAVA Programming (JAV) is an advantage; ;. 1 year's experience in Storage Area Network (SAN) is an advantage; ;. 1 year's experience in Security Risk Assessment (SRA) is an advantage. ;Non-technical Skills: ;. At least 3 years' experience in the management and support of Government systems and services (GSS); ;. Excellent written English is a must; ;. At least 3 years' experience in vendor management (VMG); ;. 1 year's experience in work with the Government (GOV) is an advantage; ;. 1 year's experience in IT service/outsourcing management (OUT) is an advantage. ;- Bachelor's degree/Higher Diploma in Computer Science, IT or equivalent; ;- At least 6 years' post-qualification experience in which at least 1 year's relevant experience in a similar post and in a comparable capacity.""",N/A,03 Mar 2025,itcareer@infotech.com.hk,2836 0363,"=Hyperlink(""https://www.infotech.com.hk/itjs/job/fe-view.do?method=feView&jjKey=33134"")"
33176,Contract Systems Analyst (Bid Ref 53729-1),1,Others,Contract,19 Mar 2025,01 May 2025 to 30 Apr 2026 (12 months),under InfoTech,Government T26 Contract,Kowloon Tong,N/A - N/A,"""(T26) T-surf24/7 is developed to cater for teachers' access to their personal profile of professional development and training, as well as to disseminate relevant training information to teachers in an effective way. This platform extracts data from both Training Calendar System (TCS) and e-Services Portal. Suitable training programmes will then be identified and fed to the teachers' notification dashboard or email boxes for enrollment. The platform was rolled out and continuous enhancements are undergoing.""","""- Serve a contract assignment under InfoTech's headcount, full-time second to serve the EDB; ;* To analyse the e-Services Portal, TIM, TCS and TAS and take the lead in the system enhancements of T-surf24/7 with integration of the above systems including feasibility study, system analysis and design (SA&D), user acceptance test (UAT), system roll-out, nursing and maintenance. ; ;* To coordinate T-contract staff in e-Services Team and TCS Team, and liaise with Information Technology Management Division (ITMD), contractors and other parties in the development of the T-surf24/7. ; ;* To assist in preparation of the Work Assignment Brief for System Maintenance & Support for the T-surf24/7. ; ;* To assist in preparation of the quotation documents for procurement related to the development of the T-surf24/7. ; ;* To monitor the progress of the T-surf24/7 and comment technically on the submissions made by the contractor of System Maintenance & Support. ; ;* To produce project reports and specifications for the purposes of project management, etc. ; ;* To oversee the e-Services Portal, TIM, TAS and TCS, draft requirement specification and perform user acceptance test (UAT) for system rectification and enhancement. ; ;* To perform any other tasks as required by his/her supervisors. ;""",5.0,1.0,"""The System Analyst must have ; ;(i) at least five years' post-qualification information technology experience of which one year must be in a similar post and in a comparable capacity, and should be proficient in knowledge management, application development, implementation or maintenance using programming languages such as JAVA, J2EE (including the UI framework for Java EE), XML, SQL, VISUAL BASIC, WEB SERVICES and .NET; ; ;(ii) knowledge and experience in systems analysis and design; ; ;(iii) a good command of both English and Chinese; ; ;(iv) good communication and inter-personal skills; ; ;(v) ability for teamwork; and ; ;(vi) ability to work under pressure. ; ; ;Experience in feasibility/technical studies and team leading/supervision is an advantage. ;Technical Skills: ;. At least 4 years' experience in IT Application Development and Management (ADM); ;. At least 1 year's experience in J2EE Development (JDE); ;. At least 1 year's experience in Structured Query Language (SQL); ;. At least 1 year's experience in Web Services (WSV); ;. At least 1 year's experience in XML (XML); ;. 2 years' experience in Visual Basic (VBC) is an advantage; ;. 2 years' experience in Visual Studio. Net (VSN) is an advantage; ;. 2 years' experience in Knowledge Management Technology (KMT) is an advantage; ;. 1 year's experience in JAVA Programming (JAV) is an advantage. ;Non-technical Skills: ;. At least 2 years' experience in work with the Government (GOV); ;. At least 1 year's experience in project management (PRM); ;. 1 year's experience in customer service (CLS) is an advantage; ;. 1 year's experience in conducting IT training/briefing (ITT) is an advantage. ;- Bachelor's degree/Higher Diploma in Computer Science, IT or equivalent; ;- At least 5 years' post-qualification experience in which at least 1 year's relevant experience in a similar post and in a comparable capacity.""",N/A,05 Mar 2025,itcareer@infotech.com.hk,2836 0363,"=Hyperlink(""https://www.infotech.com.hk/itjs/job/fe-view.do?method=feView&jjKey=33176"")"
33121,Contract Project Manager (Bid Ref 53658-1),1,Others,Contract,17 Mar 2025,02 May 2025 to 27 Feb 2026 (9 months),under InfoTech,Government T26 Contract,Tseung Kwan O,N/A - N/A,"""(T26) To manage and provide professional IT advice for the implementation of new self-service kiosk for the Immigration Department (ImmD).""","""- Serve a contract assignment under InfoTech's headcount, full-time second to serve the ImmD; ;The staff will be responsible for managing the implementation of the new self-service kiosk. Tasks includes: ;(a) to lead, manage and plan the implementation of the new self-service kiosk at ImmD HQs. ;(b) to supervise the internal project team and monitor the contractors in the provision of support and implementation services on the new self-service kiosk; ;(c) to monitor contractor's work and provide technical advice on contractor's deliverables; ;(d) to devise the appropriate strategies for project implementation; ;(e) to plan ahead and identify contingencies and alternatives, as well as manage deviations and risks; ;(f) to closely collaborate with the contractors, users and other project teams in ImmD in the course of exercising the duties; ;(g) to manage and motivate the human resources; and ;(h) to perform any other duties as may be required. ;""",8.0,2.0,"""The CPM should possess strong planning, decision making, management as well as good communication skills, and has experience in managing large-scale IT projects. ; ;Experience in project management, outsourcing management will be an advantage. ; ;Criminal record check is required. ;Technical Skills: ;. At least 7 years' experience in IT Planning (ITP); ;. At least 7 years' experience in Multi-vendor Mission Critical System (MCS); ;. At least 7 years' experience in System Implementation and Maintenance/Support (SIM). ;Non-technical Skills: ;. At least 6 months' experience in managing Government projects (MGP); ;. At least 6 months' experience in IT service/outsourcing management (OUT). ;- Bachelor's degree/Higher Diploma in Computer Science, IT or equivalent; ;- At least 8 years' post-qualification experience in which at least 2 years' relevant experience in a similar post and in a comparable capacity.""",N/A,03 Mar 2025,itcareer@infotech.com.hk,2836 0363,"=Hyperlink(""https://www.infotech.com.hk/itjs/job/fe-view.do?method=feView&jjKey=33121"")"
33022,Contract Systems Analyst (Bid Ref 52999-1),1,Others,Contract,10 Mar 2025,01 May 2025 to 30 Apr 2026 (12 months),under InfoTech,Government T26 Contract,Ho Man Tin Government Offices and Grand City Plaza in Tsuen Wa,N/A - N/A,"""(T26) Manage the maintenance and support for Audit Inspection & Management System (AIMS)""","""- Serve a contract assignment under InfoTech's headcount, full-time second to serve the HyD; ; Perform system upgrade for AIMS. ; Provide technical support for AIMS. ; Supervise and provide system maintenance & support for AIMS. ; Monitor, facilitate and implement the enhancement for AIMS. ; Prepare and update system related documents. ; Perform any other duties as assigned by the supervisor. ;""",8.0,6.0,"""Please refer to technical requirement. ;Besides, the staff will need to work at Ho Man Tin Government Offices and Grand City Plaza in Tsuen Wan as when required. ;Technical Skills: ;. At least 7 years' experience in MS ASP.NET (MSA); ;. At least 7 years' experience in Web Services (WSV); ;. At least 6 years' experience in Microsoft SQL Server (MSS); ;. At least 6 years' experience in Structured Query Language (SQL); ;. 3 years' experience in Visual Studio. Net (VSN) is an advantage; ;. 3 years' experience in PDA (PDA) is an advantage. ;Non-technical Skill: ;. 2 years' experience in work with the Government (GOV) is an advantage. ;- Bachelor's degree/Higher Diploma in Computer Science, IT or equivalent; ;- At least 8 years' post-qualification experience in which at least 6 years' relevant experience in a similar post and in a comparable capacity.""",N/A,24 Feb 2025,itcareer@infotech.com.hk,2836 0363,"=Hyperlink(""https://www.infotech.com.hk/itjs/job/fe-view.do?method=feView&jjKey=33022"")"
33081,Contract Systems Analyst (Bid Ref 53639-1),1,Others,Contract,14 Mar 2025,01 Apr 2025 to 31 Jan 2026 (10 months),under InfoTech,Government T26 Contract,Kwun Tong,N/A - N/A,"""(T26) Implementation and support of the Electronic Poll Register (EPR) System and other IT systems""","""- Serve a contract assignment under InfoTech's headcount, full-time second to serve the REO; ;- To perform system analysis & design, application development, technical support and maintenance etc. for the EPR System and other IT systems; ;- To perform system testing on the EPR System and other IT systems; ;- To coordinate with contractors for performing system development, independent assessment and testing for the EPR System and other IT systems; ;- To assist in IT procurement of various hardware, software and services; and ;- To perform any other duties assigned by supervisor. ;""",10.0,8.0,"""Please refer to the technical and non-technical requirements ;Technical Skills: ;. At least 6 years' experience in Java Application Framework (e.g. Struts (Apache)) (JAF); ;. At least 6 years' experience in J2EE Development (JDE); ;. At least 6 years' experience in Structured Query Language (SQL); ;. 1 year's experience in Data Administration (DAM) is an advantage; ;. 1 year's experience in Security Risk Assessment and Audit (SAA) is an advantage. ;Non-technical Skills: ;. At least 6 years' experience in work with the Government (GOV); ;. At least 4 years' experience in software testing (STM); ;. At least 1 year's experience in vendor management (VMG); ;. At least 1 year's experience in IT service/outsourcing management (OUT); ;. At least 1 year's experience in IT procurement (PRO). ;- Bachelor's degree/Higher Diploma in Computer Science, IT or equivalent; ;- At least 10 years' post-qualification experience in which at least 8 years' relevant experience in a similar post and in a comparable capacity.""",N/A,28 Feb 2025,itcareer@infotech.com.hk,2836 0363,"=Hyperlink(""https://www.infotech.com.hk/itjs/job/fe-view.do?method=feView&jjKey=33081"")"
33156,Contract Senior Systems Analyst (Bid Ref 53653-1),1,Others,Contract,18 Mar 2025,02 May 2025 to 31 Dec 2025 (7 months),under InfoTech,Government T26 Contract,ImmD HQ at Tseung Kwan O and occasionally provide support at various ImmD control points and offices,N/A - N/A,"""(T26) To provide management support and IT advice for the provision of enhancement of Immigration CONtrol Systems (ICONS) and Advance Passenger Information System (APIS).""","""- Serve a contract assignment under InfoTech's headcount, full-time second to serve the ImmD; ;(a) To provide management support and IT advice on the enhancement of ICONS for the 15th National Game;;(b) To supervise and provide technical support for the change of the APIS for the migration of Lotus Notes to Central Managed Messaging Platform (CMMP) by ImmD;;(c) To review deliverables of contractors to assure the quality of work and compliance with government standards; ;(d) To perform diagnosis with contractors on technical issues and monitor the progress of the remedy actions; and;(e) To perform other duties required for meeting the department's business need. ;""",6.0,2.0,"""- Strong experience in IT Application Development and Management;- Strong experience in providing technical support on multi-tier and multi-vendor mission critical systems;- Strong experience in supporting Government systems and managing vendors;- Solid experience in J2EE and Lotus Notes;- The contract staff is required to take up on-call duty;- The contract Staff will normally work in ImmD HQ at Tseung Kwan O, and occasionally provide support at various Immigration control points and offices;- The contract Staff will have to work outside normal office hours occasionally to meet the operational needs;- Criminal record check is required ;Technical Skills: ;. At least 4 years' experience in J2EE Development (JDE); ;. At least 3 years' experience in Multi-vendor Mission Critical System (MCS); ;. At least 3 years' experience in System Implementation and Maintenance/Support (SIM); ;. At least 2 years' experience in Lotus Notes Mail Admin. & Technical Support (LNM). ;Non-technical Skill: ;. At least 3 years' experience in project development in specified business areas (PDE). ;- Bachelor's degree/Higher Diploma in Computer Science, IT or equivalent; ;- At least 6 years' post-qualification experience in which at least 2 years' relevant experience in a similar post and in a comparable capacity.""",N/A,04 Mar 2025,itcareer@infotech.com.hk,2836 0363,"=Hyperlink(""https://www.infotech.com.hk/itjs/job/fe-view.do?method=feView&jjKey=33156"")"
